titles,lastest_Chap,types,views,follows,condition,discription,teasers,links 
Wolf & Parchment,Chapter 13,"Thể loại:Adventure, Comedy, Drama, Manga, Romance, Seinen, Slice of Life",Tình trạng:Đang tiến hành,Bình luận:56,Tác giả:HASEKURA Isuna,"Ngày xửa ngày xưa, Tote Col, một cậu bé học việc lang thang chưa tròn mười, đã được cưu mang bởi một vị thương nhân lưu động và hiền giả sói. Cuộc hành trình của họ đã kết thúc cách đây mười lăm năm, nhưng chặng hành trình của cậu bé Col chỉ mới bắt đầu. Vị giáo sĩ đầy hứa hẹn này bất đắc dĩ phải đồng hành với cô em gái sói, Myuri. Anh đặt ra một kế hoạch không tưởng, đầy tham vọng là phiên dịch Kinh Thánh sang ngôn ngữ chung với sự giúp đỡ của vương quốc Winfiel và thương hội Debau. Nhưng dự án ""Sách Kinh Thánh của chúng ta"" đã thách thức quyền lực của tất cả các Giáo hội quyền năng ...!",//st.nettruyenup.com/data/comics/144/wolf-parchment.jpg,https://www.nettruyenup.com/truyen-tranh/wolf-parchment-65680
Sono Mono. Nochi Ni…(Nariie Shin’Ichirou),Chapter 29.5,Tác giả:Nariie Shin’ichirou,Lượt xem:3.786K,Theo dõi:40K,Tình trạng:Đang tiến hành,"Bộ truyện dựa theo light novel cùng tên wazu- một người dân bình thường đã tới Moutain sau một sự kiện không may, sau hai năm anh ta quyết định rới khỏi núi để trở lại với cuộc sống bình thường, cuộc hành trình của cậu bắt đầu từ đây. Và sau đó....",//st.nettruyenup.com/data/comics/75/sono-mono-nochi-ninariie-shinichirou.jpg,https://www.nettruyenup.com/truyen-tranh/sono-mono-nochi-ninariie-shinichirou-195310
Tensei Oujo to Tensai Reijou no Mahou Kakumei,Chapter 17,"Thể loại:Action, Adventure, Comedy, Drama, Isekai, Magical, Manga, Romance, Seinen, Shoujo Ai, Soft Yuri",Tình trạng:Đang tiến hành,Bình luận:446,Tác giả:Karasu Piero - Kisaragi Yuri,"Anne-Sophia, một cô công chúa đã nhớ lại ký ức tiền kiếp của bản thân từ khi còn nhỏ. Cùng với tình yêu ma thuật mãnh liệt từ con người trước đây của mình , cô sẽ bắt đầu một cuộc sống mới tại thế giới huyễn tưởng này.Một ngày nọ, trong một tai nạn lúc thử nghiệm ma thuật, cô tình cờ bắt gặp cảnh em trai mình, Algard, đang hủy bỏ hôn ước với Euphilia, hôn thê của cậu ta.Chuyện mà không một ai có thể ngờ được là cuộc gặp gỡ kỳ lạ này sẽ khiến cả lịch sử thay đổi.",//st.nettruyenup.com/data/comics/169/tensei-oujo-to-tensai-reijou-no-mahou-ka-9450.jpg,https://www.nettruyenup.com/truyen-tranh/tensei-oujo-to-tensai-reijou-no-mahou-kakumei-349850
Cô Đi Mà Kết Hôn Với Chồng Tôi Đi,Chapter 68,"Thể loại:Comedy, Drama, Manhwa, Ngôn Tình, Truyện Màu",Lượt xem:17M,Theo dõi:123K,Tình trạng:Đang tiến hành,"Tôi mắc bệnh ung thư chỉ sống vỏn vẹn được vài tháng nữa nhưng như vậy đã nhằm nhò gì. Thứ khiến cuộc đời tôi nghiệt ngã hơn chính là việc chồng tôi ngoại tình với bạn thân của tôi. Đã vậy anh ta còn giết tôi, kết liễu cuộc đời vốn đã ngắn ngủi ấy của tôi. May thay kỳ tích xuất hiện đưa tôi quay lại thời điểm 10 năm trước… Tôi quyết định đẩy vận mệnh đen đủi của bản thân sang người chồng đó. Vì vậy, kế hoạch của tôi là để cho bạn thân khốn nạn của tôi kết hôn với thằng chồng đó… Còn tôi sẽ yêu đương và kết hôn với một người chồng tốt, yêu thương tôi.d",//st.nettruyenup.com/data/comics/220/co-di-ma-ket-hon-voi-chong-toi-di.jpg,https://www.nettruyenup.com/truyen-tranh/co-di-ma-ket-hon-voi-chong-toi-di-547483
Nhà Sưu Tập Dị Thường,Chapter 6,Tình trạng:Đang tiến hành,Bình luận:35,Ngày cập nhật:17 ngày trước,Lượt xem:16K,"Lí Phàm du hành đến một thế giới xa lạ, ở đây có những dị thường chi vật tồn tại, Và với tư cách là một thực tập sinh trong Cơ quan Ứng phó di thường, Vào ngày đầu tiên đi làm, tôi đột nhiên phát hiện ra rằng mình là nhân vật phản diện thứ hai trên thế giới này——nhà sưu tập.""Ta ăn cơm chờ nghỉ hưu đi, được không?"",""nhà sưu tập đại nhân, tất cả các anh em đều ủng hộ ngài với tư cách là hội trưởng, chúng ta quên nó đi được không?""",//st.nettruyenup.com/data/comics/123/nha-suu-tap-di-thuong.jpg,https://www.nettruyenup.com/truyen-tranh/nha-suu-tap-di-thuong-77691
Thời Khắc Để Hiến Dâng Cái Chết Của Ngươi Đã Tới,Chapter 36,"Thể loại:Cổ Đại, Drama, Fantasy, Josei, Manhwa, Ngôn Tình, Truyện Màu",Lượt xem:472K,Theo dõi:14K,Tình trạng:Đang tiến hành,"”Thời khắc để hiến dâng cái chết của ngươi đã tới”-illian đã 40 tuổi, và vào một ngày nọ khi cô mở mắt, một bàn tay nhỏ nhắn là thứ đầu tiên xuất hiện trong tầm nhìn của cô. Một người lính đánh thuê trung niên đã quay trở lại 10 năm về trước và biến thành một đứa trẻ 12 tuổi có tên Haven Winter! Trước hết, gia đình đã tan vỡ trong quá khứ cần có một khởi đầu mới. Giờ đây, khi đã quay trở về quãng thời gian năm xưa, cô nhất định phải bảo vệ những điều mà ở trong cuộc đời trước của mình, cô đã không thể che chở. Thế nhưng… một người luôn quấy rầy cô trong quá khứ cũng đã đặt chân đến kiếp này. “Bởi vì cô không phải illian Heinrich.” Bản thân tôi trong quá khứ đã từng là cái quái gì với cậu vậy chứ?",//st.nettruyenup.com/data/comics/151/thoi-khac-de-hien-dang-cai-chet-cua-nguo-2718.jpg,https://www.nettruyenup.com/truyen-tranh/thoi-khac-de-hien-dang-cai-chet-cua-nguoi-da-toi-73111
Flower War - Season 1,Chapter 22,Tình trạng:Đang tiến hành,Bình luận:20,Ngày cập nhật:09:14 23/01,Lượt xem:43K,,//st.nettruyenup.com/data/comics/106/flower-war-season-1.jpg,https://www.nettruyenup.com/truyen-tranh/flower-war-season-1-77674
Maou Gakuen no Hangyakusha,Chapter 25,"Thể loại:Action, Adult, Comedy, Drama, Ecchi, Fantasy, Harem, Manga, Mature, Mystery, Romance, School Life, Seinen, Supernatural",Tình trạng:Đang tiến hành,Bình luận:1.297,Tác giả:KUJI MASAMUNE,"Một học sinh cao trung bình thường, Morioka Yuuto, được chọn làm ứng cử viên cho Quỷ Vương tiếp theo. Cậu bị chuyển đến học viện dành cho ác quỷ, học viện Ginsei (Ngôi Sao Bạc) nơi cậu bị các học viên khác khinh bỉ. [--Chị thề chị sẽ khiến em trở thành Quỷ Vương. Đó là lý do.....chị trở thành tùy tùng của em.] Cuộc gặp gỡ giữa Yuuto với một ác quỷ mĩ miều, Himekami Lizel đã thay đổi số phận và thế giới của cậu. Cậu có thể học bất kì loại phép thuật nào ngay lập tức và khả năng hấp thụ sức mạnh phép thuật là vô hạn nhờ việc động chạm thân thể với những cô gái tùy tùng của cậu. Đó là một năng lực đặc biệt mà tộc ác quỷ không có, chỉ độc nhất có ở con người tên Yuuto. Ứng cử viên cho Quỷ Vương tiếp theo đã thách đấu với các ác quỷ mạnh nhất để trở thành Quỷ Vương công lý. Câu chuyện viễn tưởng đầy thú vị và hấp dẫn về leo hạng trong học viện phép thuật bắt đầu!",//st.nettruyenup.com/data/comics/47/maou-gakuen-no-hangyakusha.jpg,https://www.nettruyenup.com/truyen-tranh/maou-gakuen-no-hangyakusha-305110
Chu du hậu tận thế,Chapter 4,"Thể loại:Action, Adventure, Drama, Manga, Mystery, Sci-fi, Seinen",Tình trạng:Đang tiến hành,Bình luận:18,Tác giả:Saitoh Sakae,"Trơ trọi giữa Nhật Bản hậu tận thế, hai cô gái đã lên chuyến hành trình đi chu du khắp mọi miền, vừa để thưởng thức cảnh sắc, vừa để khám phá bí ẩn và cũng là để tìm lại chị gái của mình. Dẫu cho thế giới có tận diệt, giấc mộng phiêu lưu vẫn không ngừng lăn bánh!",//st.nettruyenup.com/data/comics/151/chu-du-hau-tan-the.jpg,https://www.nettruyenup.com/truyen-tranh/chu-du-hau-tan-the-76439
Du khách vào ban đêm bí ẩn,Chapter 7,"Thể loại:Drama, Manhwa, Ngôn Tình, Psychological, Truyện Màu",Lượt xem:35K,Theo dõi:4.058,Tình trạng:Đang tiến hành,"Ruby không bao giờ mong đợi được đưa vào thế giới của một cuốn tiểu thuyết… ít nhất là một cuốn tiểu thuyết tình yêu của những chàng trai cay cú! Khi một điều như vậy xảy ra, một cô gái phải làm gì? Tất nhiên, hãy tận dụng tối đa nó bằng cách trở thành một nữ doanh nhân thành đạt điều hành một nhà trọ sang trọng! Tiền bạc và quyền lực là một chuyện, nhưng cơ hội được nhìn thấy và giao lưu với những anh chàng hấp dẫn yêu thích của cô ấy từ câu chuyện là một phần thưởng thêm. Chỉ có một vấn đề và đó là nhân vật phản diện bí ẩn, đầy mưu mô. Những gì trước đây chỉ là một vài viên kẹo mắt đang nghiền ngẫm bây giờ là một mối đe dọa rất thực sự đối với cuộc sống của Ruby. Liệu Ruby có thể điều động được vị khách đầy mưu mô này, hay câu chuyện này sẽ kết thúc trong bi kịch?",//st.nettruyenup.com/data/comics/142/du-khach-vao-ban-dem-bi-an.jpg,https://www.nettruyenup.com/truyen-tranh/du-khach-vao-ban-dem-bi-an-68494
"The Most Notorious ""Talker"" Runs the World's Greatest Clan",Chapter 33,"Thể loại:Action, Adventure, Comedy, Drama, Fantasy, Manga, Psychological, Tragedy",Lượt xem:982K,Theo dõi:25K,Tình trạng:Đang tiến hành,"Noel, vì ngưỡng mộ người ông vĩ đại được tôn sùng như một anh hùng, mà mơ ước trờ thành một Truy thủ. Tuy nhiên, cậu lại được sinh ra với chức nghiệp được coi là yếu ớt nhất: ""Thánh Ngôn"". [ Nếu như tôi không thể trở thành kẻ mạnh nhất, tôi chỉ cần sáng lập ra một Clan và điều hành nó trở thành số một, tôi sẽ trở thành kẻ mạnh nhất]. Tuy sở hữu chức nghiệp được coi là yếu nhất, nhưng bằng khả năng chỉ huy thiên bẩm, từng kẻ hùng mạnh một dần quy tụ dưới trướng Noel. Và từ đây, hành trình của Thánh Ngôn tàn độc nhất, kẻ vươn lên trở thành số một thế giới, bắt đầu.",//st.nettruyenup.com/data/comics/82/the-most-notorious-talker-runs-the-world-5363.jpg,https://www.nettruyenup.com/truyen-tranh/the-most-notorious-talker-runs-the-worlds-greatest-clan-338740
"Umi no Yami, Tsuki no Kage",Chapter 95,"Thể loại:Drama, Horror, Manga, Romance, Shoujo",Lượt xem:150K,Theo dõi:1.170,Tình trạng:Đang tiến hành,,//st.nettruyenup.com/data/comics/137/umi-no-yami-tsuki-no-kage.jpg,https://www.nettruyenup.com/truyen-tranh/umi-no-yami-tsuki-no-kage-9050
Tuyệt thế Đường Môn - Đấu La Đại Lục 2,Chapter 354,Tác giả:Đường Gia Tam Thiếu,Lượt xem:56M,Theo dõi:74K,Tình trạng:Đang tiến hành,"Nơi đây không có ma pháp, không có đấu khí, cũng không có võ thuật, chỉ có duy nhất thứ gọi là Vũ Hồn. Trên mảnh đất Đấu La Đại Lục, Đường Môn sau vạn năm huy hoàng đã bắt đầu bước vào con đường suy thoái. Một lớp anh tài mới xuất hiện, liệu thế hệ Sử Lai Khắc Thất Quái mới này có chấn hưng được Đường Môn hay không? Bản anh hùng ca về Đường Môn khi xưa có thể tái hiện một lần nữa hay không? - Bản thân có Bách vạn niên hồn thú, tay cầm thần cung Nhật Nguyệt Trích Tinh của Tử Linh Thánh Pháp Thần, khi hắn xuất hiện liền tiếp thêm một luồng sinh khí mới cho Đường Môn đã suy yếu. Tất cả bí ẩn dần dần hé mở... - Liệu ám khí Đường Môn có thể lại một lần nữa danh chấn thiên hạ không? Huy hoàng của Đường Môn khi xưa phải chăng còn có thể tái hiện? Mọi thứ đều nằm ở đây - Tuyệt Thế Đường Môn.",//st.nettruyenup.com/data/comics/138/tuyet-the-duong-mon-dau-la-dai-luc-2.jpg,https://www.nettruyenup.com/truyen-tranh/tuyet-the-duong-mon-dau-la-dai-luc-2-90980
Amai Seikatsu - Cuộc sống tươi đẹp,Chapter 20,"Thể loại:Drama, Ecchi, Harem, Manga, Romance, Seinen, Slice of Life",Tình trạng:Đang tiến hành,Bình luận:43,Tác giả:Hikaru Yuzuki,"Câu chuyện đầy khả ái và say đắm lòng người về anh chàng sinh viên chưa tốt nghiệp đi làm ở công ty đồ lót nữ bằng tài năng rất ""bựa"".",//st.nettruyenup.com/data/comics/120/amai-seikatsu-cuoc-song-tuoi-dep.jpg,https://www.nettruyenup.com/truyen-tranh/amai-seikatsu-cuoc-song-tuoi-dep-126640
Tôi Mang Trong Mình Trái Tim Của Rồng,Chapter 10,"Thể loại:Drama, Fantasy, Manhwa, Romance, Shoujo, Truyện Màu, Webtoon",Lượt xem:57K,Theo dõi:4.347,Tình trạng:Đang tiến hành,,//st.nettruyenup.com/data/comics/207/toi-mang-trong-minh-trai-tim-cua-rong.jpg,https://www.nettruyenup.com/truyen-tranh/toi-mang-trong-minh-trai-tim-cua-rong-74447
Tebukuro Wo Shita Onna No Ko,Chapter 10,Tình trạng:Đang tiến hành,Bình luận:70,Ngày cập nhật:19:27 11/01,Lượt xem:96K,Một cô gái nhút nhát mang trong mình lời nguyền và bạn trai người luôn sẵn sàng hi sinh vì lời nguyền.,//st.nettruyenup.com/data/comics/253/tebukuro-wo-shita-onna-no-ko.jpg,https://www.nettruyenup.com/truyen-tranh/tebukuro-wo-shita-onna-no-ko-266210
Cưỡi Trên Bờ Hủy Diệt,Chapter 23,"Thể loại:Action, Adventure, Drama, Fantasy, Manhwa, Martial Arts, Mature, Mystery, Truyện Màu",Lượt xem:235K,Theo dõi:6.437,Tình trạng:Đang tiến hành,"Yu XiaoBei, một công nhân, để trả tiền phẫu thuật cho em gái mình, anh ta đã chọn bước vào đấu trường bí ẩn và biết được rằng nếu anh ta sống sót đến cuối cùng, anh ta sẽ có thể kiểm soát nền kinh tế thế giới. Bất ngờ thay, Yu XiaoBei sẽ phải đối mặt với những đối thủ nguy hiểm của mình, bị nhốt chung với một con quái vật và tham gia vào một trò chơi tử thần ly kỳ.",//st.nettruyenup.com/data/comics/181/cuoi-tren-bo-huy-diet.jpg,https://www.nettruyenup.com/truyen-tranh/cuoi-tren-bo-huy-diet-71861
Ochibure oujou to isekai yuusha no ritsu koku shi,Chapter 13,"Thể loại:Adventure, Comedy, Drama, Fantasy, Manga, Seinen, Slice of Life",Lượt xem:113K,Theo dõi:4.513,Tình trạng:Đang tiến hành,Công chúa bỏ nhà đi bụi và dị giới dũng giả cùng nhau lập cuốc :v(Sr vì font cùng edit đau mắt vì t chỉ là thk trans gà mờ mới tập tành làm edit),//st.nettruyenup.com/data/comics/207/ochibure-oujou-to-isekai-yuusha-no-ritsu-3667.jpg,https://www.nettruyenup.com/truyen-tranh/ochibure-oujou-to-isekai-yuusha-no-ritsu-koku-shi-391190
Kamitachi Ni Hirowareta Otoko,Chapter 42.1,Tình trạng:Đang tiến hành,Bình luận:2.213,Ngày cập nhật:10:20 10/01,Lượt xem:3.026K,"Ryouma Takuma, một người đàn ông 39 tuổi với quá khứ bị che giấu, tỉnh dậy trong một căn phòng lạ màu trắng. Những vị thần bảo rằng anh đã chết và họ sẽ gửi linh hồn anh tới một thế giới khác, nơi mà phép thuật tồn tại. Sống một mình trong vòng 3 năm, linh hồn người chơi của anh mất dần tri giác và bắt đầu hướng tới những con đường điên rồ.",//st.nettruyenup.com/data/comics/253/kamitachi-ni-hirowareta-otoko.jpg,https://www.nettruyenup.com/truyen-tranh/kamitachi-ni-hirowareta-otoko-181730
Blue Giant,Chapter 13,Tác giả:Ishizuka Shinichi,Lượt xem:13K,Theo dõi:470,Tình trạng:Đang tiến hành,"Dai Miyamoto sống một cuộc sống trung học bình thường ở Sendai: một thành phố của những ngày hè nóng nực và những đêm mưa. Giữa bóng rổ, công việc bán thời gian và một tương lai không chắc chắn, vẫn còn thiếu một thứ gì đó. Và thứ đó là âm nhạc. Khi những ngày cuối cấp sắp hết, Dai thề một lời thề chân thành: “Tôi sẽ trở thành người chơi nhạc jazz hay nhất thế giới.” Nhưng bạn cần gì để trở thành người giỏi nhất? Tài năng? Cố gắng? Một sự may mắn? Hoặc có thể chỉ là một tình yêu sâu sắc, thuần khiết dành cho âm nhạc! Manga đã được đề cử cho giải thưởng Manga Taisho lần thứ 8 vào năm 2015, và thứ 9 vào năm 2016. Ngoài ra, Manga đã chiến thắng Grand Prize trong Manga Division của Lễ trao giải Liên hoan Nghệ thuật Truyền thông Nhật Bản lần thứ 20 năm 2017.",//st.nettruyenup.com/data/comics/97/blue-giant.jpg,https://www.nettruyenup.com/truyen-tranh/blue-giant-73825
Tam Nhãn Hao Thiên Lục,Chapter 321.2,Tình trạng:Đang tiến hành,Bình luận:16K,Ngày cập nhật:07:14 09/01,Lượt xem:14M,Dương Tiễn Hạ Phàm Diệt Trừ Yêu Quái Dưới Hình Hài Một Người Con Gái. Đọc sẽ rõ ~.~,//st.nettruyenup.com/data/comics/71/tam-nhan-hao-thien-luc.jpg,https://www.nettruyenup.com/truyen-tranh/tam-nhan-hao-thien-luc-44230
Kowloon Generic Romance,Chapter 25,"Thể loại:Comedy, Drama, Manga, Romance, Seinen, Slice of Life",Tình trạng:Đang tiến hành,Bình luận:150,Tác giả:MAYUZUKI Jun,Cửu Long Trại Thành - Chốn hỗn độn nhất thế kỷ 20. Một chuyện tình dịu dàng sẽ nảy nở ở miền đất phản địa đàng này.,//st.nettruyenup.com/data/comics/19/kowloon-generic-romance.jpg,https://www.nettruyenup.com/truyen-tranh/kowloon-generic-romance-453310
Ani to Imouto no Shitai Shitai Shitai Koto,Chapter 12,"Thể loại:Comedy, Drama, Manga, Romance",Tình trạng:Đang tiến hành,Bình luận:1.062,Tác giả:Hano Haruka,Main là một hoạ sĩ hentai và những cảnh in sẹc đầy rẩy mấy bộ bên 2ten khỏi nói rồi  mà nội dung chả có gì mới chỉ khác một đều là... hén tài trá hình,//st.nettruyenup.com/data/comics/221/ani-to-imouto-no-shitai-shitai-shitai-ko-8798.jpg,https://www.nettruyenup.com/truyen-tranh/ani-to-imouto-no-shitai-shitai-shitai-koto-578210
Tinh Mộng Thần Tượng,Chapter 351,Tình trạng:Hoàn thành,Bình luận:16K,Ngày cập nhật:31/12/22,Lượt xem:38M,"Cố Tinh Hải và Kim Uất Huyền là đôi bạn rất thân, có nhiều ước hẹn tương lại. Rồi bỗng biến cố xảy ra khiến đôi bạn phải xa cách. Họ rồi sẽ ra sao. Mời các bạn xem truyện…",//st.nettruyenup.com/data/comics/150/tinh-mong-than-tuong.jpg,https://www.nettruyenup.com/truyen-tranh/tinh-mong-than-tuong-121820
Tôi nguyện được chết để lấy trinh tiết em,Chapter 23,"Thể loại:Drama, Ecchi, Manga, Romance, Shounen",Tình trạng:Đang tiến hành,Bình luận:485,Tác giả:Tearontaron,"Một nhân viên văn phòng làm công ăn lương mặc dù đã có mái ấm vợ đẹp, anh vẫn mặc cảm tự ti về bản thân mình và phải sống trong nỗi ám ảnh về khao khát được nhìn thấy những biểu cảm từ con người sâu thẳm trong cô. Tưởng chừng như phải chấp nhận sống chung trong sự khác biệt quá lớn về mặt ngoại hình và cảm xúc giữa mình và cô vợ.Anh được xuyên không làm lại cuộc đời.",//st.nettruyenup.com/data/comics/105/toi-nguyen-duoc-chet-de-lay-trinh-tiet-e-3020.jpg,https://www.nettruyenup.com/truyen-tranh/toi-nguyen-duoc-chet-de-lay-trinh-tiet-em-369690
Thần chết làm thêm 300 yên/giờ,Chapter 10,"Thể loại:Drama, Manga, Romance, Slice of Life, Supernatural, Tragedy",Tình trạng:Đang tiến hành,Bình luận:61,Tác giả:Fujimaru - KIRIHARA Idumi,"""Vậy thì tôi sẽ tuyển cậu làm thần chết."" Một ngày nọ, học sinh cấp 3 Sakura Shinji được cô bạn cùng lớp Hanamori Yuki mời làm công việc của 'thần chết'. Một công việc mà giúp những người chưa thể siêu thoát, vẫn còn vấn vương với cuộc sống trần gian trút bỏ hết những luyến tiếc và tiễn họ sang thế giới bên kia... (Một câu truyện, về khía cạnh của cuộc sống và đẫm nước mắt).",//st.nettruyenup.com/data/comics/125/than-chet-lam-them-300-yengio.jpg,https://www.nettruyenup.com/truyen-tranh/than-chet-lam-them-300-yengio-73341
Quyển sổ báo thù,Chapter 76,"Thể loại:Action, Drama, Manga, Psychological, School Life, Slice of Life",Tình trạng:Đang tiến hành,Bình luận:1.612,Tác giả:HIROSE Shun,"Ryotaro Kurose, một học sinh trung học mơ ước trở thành giáo viên. Anh ta khao khát được giống như giáo viên chủ nhiệm của mình, nhưng đang phải chịu đựng sự bắt nạt khủng khiếp. Một ngày nọ, những kẻ bắt nạt sự thật bị phơi bày nên đã thủ tiêu main....với quyết tâm báo thù,cậu sẽ làm gì?",//st.nettruyenup.com/data/comics/160/quyen-so-bao-thu.jpg,https://www.nettruyenup.com/truyen-tranh/quyen-so-bao-thu-288320
Hitman,Chapter 74,Tác giả:Seo Kouji,Lượt xem:603K,Theo dõi:6.300,Tình trạng:Đang tiến hành,"Kenzaki Ryuunosuke có niềm đam mê mãnh liệt với manga, anh quyết định tham gia và làm một biên tập viên, anh bắt gặp nữ chính của chúng ta cũng trong buổi phỏng vấn đó. Anh được nhận vào làm và anh nhận ra trong này khá là khác biệt, tổng biên tập thì cứ nói cty sắp phá sản, lúc anh vào thì người hướng dẫn đi du lịch nên họ nói anh cứ thoải mãi, có người gọi điện đến hỏi về việc in ấn thì lại nói xấu họ, anh quyết định bỏ qua những lời nói đó và đi gặp khách hàng, bất ngờ thay đó lại là nữ chính người đã gặp cậu ở buổi thử việc. Một câu truyện nói về giới biên tập viên và các mangaka chứa đầy những cung bậc cảm xúc,những cuộc chiến gay cấn giữ anh với những nhà xuất bản khác, hãy cũng đọc và khám phá nó nào~ Và bộ này chung tác giả với bộ Fuuka đóa nha :3",//st.nettruyenup.com/data/comics/69/hitman.jpg,https://www.nettruyenup.com/truyen-tranh/hitman-190130
Điều mà chú vẹt muốn cảnh báo,Chapter 26,"Thể loại:Drama, Manga, Romance",Tình trạng:Đang tiến hành,Bình luận:312,Tác giả:Tatsunoko,"Bỗng một ngày,chú vẹt của bạn đột nhiên hoảng loạn và cảnh báo cho bạn về ""thứ gì đó"",bạn sẽ làm gì để thoát khỏi tình cảnh này?",//st.nettruyenup.com/data/comics/208/dieu-ma-chu-vet-muon-canh-bao.jpg,https://www.nettruyenup.com/truyen-tranh/dieu-ma-chu-vet-muon-canh-bao-76240
What Do You Wish For With Those Murky Eyes,Chapter 9,"Thể loại:Action, Drama, Fantasy, Manga, Mature, Shounen",Tình trạng:Đang tiến hành,Bình luận:382,Tác giả:Torutonen,"Một ngày nọ, Raizou Takakura, một người làm công ăn lương bình thường lên cơn đau tim và chết. Tuy nhiên anh ta được ban tặng cuộc sống thứ hai ở thế giới khác. Trong khi các bộ isekai ăn liền khác được chuyển sinh với sức mạnh vô song thì nhân vật chính không được may mắn như vậy anh ta được chuyển sinh với thân phận là tên lính thấp hèn ở một quốc gia nhỏ, đế quốc Highserk và với thân phận mới bị đẩy ra tiền tuyến phủ đầy máu và xác thịt trải qua những lần thập tử nhất sinh dần dần thức tỉnh kỹ năng.",//st.nettruyenup.com/data/comics/19/what-do-you-wish-for-with-those-murky-ey-7400.jpg,https://www.nettruyenup.com/truyen-tranh/what-do-you-wish-for-with-those-murky-eyes-66579
The Dunwich Horror - Dunwich no Kai,Chapter 10,Tác giả:TANABE Gou,Lượt xem:33K,Theo dõi:767,Tình trạng:Đang tiến hành,"Nằm trong một ngôi làng bị cô lập, hoang vắng và suy đồi của Dunwich, Massachusetts. Ẩn mình trong một vùng đất hoang vu bị nguyền rủa, của những tiếng ồn kỳ lạ, của ma thuật và những câu chuyện về phù thủy truyền từ đời này sang đời khác. Gia đình Whateley dường như đang cố che giấu một cái gì đó. 'Một thứ' vô cùng khủng khiếp đang sắp sửa trỗi dậy từ địa ngục, để khởi đầu cho một cơn ác mộng mới, cơn ác mộng của toàn thể nhân loại.",//st.nettruyenup.com/data/comics/100/the-dunwich-horror-dunwich-no-kai.jpg,https://www.nettruyenup.com/truyen-tranh/the-dunwich-horror-dunwich-no-kai-74084
