titles,lastest_Chap,types,views,follows,condition,discription,teasers,links 
Destiny Lover SS2,Chapter 43,"Thể loại:Adult, Comedy, Drama, Ecchi, Harem, Manga, Shounen, Supernatural",Tình trạng:Đang tiến hành,Bình luận:675,Tác giả:Kazutaka Kodaka,"Cốt truyện nối tiếp của Destiny Lover Phần 1, Fujishirou Kousuke là một học sinh trung học không thân thiện và khó gần. Khi còn nhỏ, anh đã hứa với người bạn thời thơ ấu của mình, Sayaka, rằng họ sẽ kết hôn khi lớn lên. Nhưng một ngày nọ, Kousuke bị bắt cóc và đưa đến một nơi kỳ lạ giống nhà tù. Thật kỳ lạ, ""nhà tù"" này được canh giữ bởi một người phụ nữ rất khiêu gợi ... Liệu Kousuke có thể thực hiện lời hứa của mình với Sayaka hay không?",//st.nettruyenup.com/data/comics/185/destiny-lover-ss2.jpg,https://www.nettruyenup.com/truyen-tranh/destiny-lover-ss2-503610
Hoa Nở Trong Cung Diên Hy Công Lược,Chapter 11,Tình trạng:Đang tiến hành,Bình luận:186,Ngày cập nhật:10/09/22,Lượt xem:98K,,//st.nettruyenup.com/data/comics/34/hoa-no-trong-cung-dien-hy-cong-luoc.jpg,https://www.nettruyenup.com/truyen-tranh/hoa-no-trong-cung-dien-hy-cong-luoc-66082
Lời Nói Dối Vĩnh Cửu,Chapter 34,"Thể loại:Cổ Đại, Drama, Manhwa, Ngôn Tình, Romance, Truyện Màu",Lượt xem:120K,Theo dõi:3.927,Tình trạng:Đang tiến hành,"Năm 17 tuổi, Rosen Walker bị bỏ tù vì tội giết chồng. Như một lời thách thức tới niềm kiêu hãnh của Quân đội Đế quốc với hai lần vượt ngục, cuối cùng cô bị bắt lại sau một năm và bị kết án tù chung thân. Trên chiếc thuyền đi đến Đảo Monte, nơi tập trung những tù nhân nguy hiểm bậc nhất, Rosen tiếp tục lên kế hoạch vượt ngục một lần nữa… “Cô phạm tội gì?” “… Tôi vô tội” “Cũng chẳng được mấy tù nhân thành thật thú nhận tội lỗi của mình.” Ian Connor, một nhà tư tưởng thẳng thắn và chính trực, người chịu trách nhiệm trong hành trình trục xuất Rosen, không hề cho cô ấy một cơ hội để bao biện. “Đừng nói những điều vô ích, chỉ cần trả lời câu hỏi thôi.” Rosen Walker, kẻ vượt ngục đẳng cấp nhất của Đế chế. Và Ian Connor, một anh hùng chiến tranh trẻ tuổi được cả Đế chế yêu mến. Câu chuyện của họ được mở ra trên con tàu hướng đến ngục tù tồi tệ nhất Trái Đất! Bây giờ, các bạn sẽ là thẩm phán. Liệu Rosen Walker có phải là kẻ nói dối không? Hay cô ấy đang nói sự thật?",//st.nettruyenup.com/data/comics/130/loi-noi-doi-vinh-cuu.jpg,https://www.nettruyenup.com/truyen-tranh/loi-noi-doi-vinh-cuu-69250
Isekai Meikyuu No Saishinbu O Mezasou,Chapter 22.2,"Thể loại:Action, Adventure, Drama, Fantasy, Manga, Seinen",Tình trạng:Đang tiến hành,Bình luận:712,Tác giả:Warina Tarisa,"Một thanh niên chuyển sinh nhưng bất ngờ bị chuyển đến một mê cung. Bị săn đuổi bởi cả con người và quái vật. Rồi sau đó anh gặp một cô gái, thể hiện tài năng chế tạo vũ khí của mình. Rồi chuyện gì sẽ tiếp diễn... Hãy đón xem",//st.nettruyenup.com/data/comics/132/isekai-meikyuu-no-saishinbu-o-mezasou.jpg,https://www.nettruyenup.com/truyen-tranh/isekai-meikyuu-no-saishinbu-o-mezasou-244520
Cinderella Wa Sagasanai.,Chapter 34,"Thể loại:Comedy, Drama, Manga, Romance",Tình trạng:Đang tiến hành,Bình luận:714,Tác giả:Tendou Gen,"Em gái tôi khi nhìn vào tòa cao tầng và cho rằng đó là một lâu đài. và lâu đài thì hẳn là sẽ có công chúa. và cô công chúa đó hẳn là sẽ ở tầng cao nhất của lâu đài. trong một lần chúng tôi đã vô tình gặp Shindou Rei, một nàng công chúa nghị trị trên đỉnh cao của lâu đài, một người lạnh lùng nhưng cũng cực kì dễ thương",//st.nettruyenup.com/data/comics/52/cinderella-wa-sagasanai.jpg,https://www.nettruyenup.com/truyen-tranh/cinderella-wa-sagasanai-305160
Thiết lập dàn Harem tại thế giới khác,Chapter 29,Tình trạng:Đang tiến hành,Bình luận:2.123,Ngày cập nhật:06/09/22,Lượt xem:4.550K,"Một thanh niên chán đời với ý định tự tử và đang tìm những cách tự tử nhẹ nhàng nhất trên internet thì vô tình vào một trang web dạng game MMORPG, thì thanh niên này quyết định chơi thử trước khi tự tử, chọn xong tuyệt chiêu và trang bị bỗng dưng ngất đi và tỉnh lại thấy mình trong thế giới game MMORPG đó và cùng với những tuyệt chiêu và trang bị đã chọn.Thanh niên tưởng đây chỉ là trò chơi nên đi chém giết đến lúc mới biết không thể đăng xuất thì mới thất thần rằng đây là thế giới thực không phải là trong trò chơi. Cuộc hành trình bắt đầu.",//st.nettruyenup.com/data/comics/81/thiet-lap-dan-harem-tai-the-gioi-khac.jpg,https://www.nettruyenup.com/truyen-tranh/thiet-lap-dan-harem-tai-the-gioi-khac-162090
Nàng Công Chúa Của Sách,Chapter 20,"Thể loại:Drama, Fantasy, Historical, Romance, Shoujo",Tình trạng:Đang tiến hành,Bình luận:842,Tác giả:Yui Kikuta - Satsuki Shiina,"Eliana là một người yêu sách và cũng là vị hôn thê của hoàng tử Christopher. Một ngày nọ cô biết đến sự tồn tại của một cô gái có lẽ đã dành được sự quý mến của hoàng tử. Ngay lập tức cô nghĩ rằng đây hẳn là cô gái thực sự yêu vẻ bề ngoài của hoàng tử. và ngay lúc ấy cô lại bắt đầu chuẩn bị đón nhận cái ngày hôn ước của cô bị hủy bỏ. cô gái quý tộc yêu sách bắt đầu có những hiểu lầm, câu chuyện lãng mạn và giả tưởng cuối cùng đã bắt đầu.",//st.nettruyenup.com/data/comics/12/nang-cong-chua-cua-sach.jpg,https://www.nettruyenup.com/truyen-tranh/nang-cong-chua-cua-sach-240760
Sát Thủ ẩn dật,Chapter 24,Tình trạng:Đang tiến hành,Bình luận:97,Ngày cập nhật:05/09/22,Lượt xem:187K,"Một sát thủ truyền thuyết chuyên về giết người cư trú ở một nào đó tại Osaka. từ khi còn rất nhỏ, đã được truyền dạy là phải tuân theo mệnh lệnh từ sếp lớn, anh ấy được ra lệnh là phải sống ở Osaka như một người bình thường trong một năm theo lệnh án binh bất động của boss.",//st.nettruyenup.com/data/comics/169/sat-thu-an-dat.jpg,https://www.nettruyenup.com/truyen-tranh/sat-thu-an-dat-275610
Nữ Công Tước Phương Bắc Là Một Nhân Vật Phản Diện,Chapter 32,Tình trạng:Đang tiến hành,Bình luận:641,Ngày cập nhật:05/09/22,Lượt xem:741K,"Eloise Wayana, nữ công tước của phương Bắc, bị Hoàng đế Caien Helisis xử tử sau khi người ta tiết lộ rằng cô đã bí mật trở thành một nhân vật phản diện. Điều này đã đánh dấu kết thúc phần hai của tiểu thuyết đang thịnh hành mới nhất, ” Vương miện máu “. Là một trong những độc giả cuồng nhiệt của bộ phim, Kim Dakyung đang háo hức chờ đợi phần tiếp theo thì cô bất ngờ bị một chiếc xe tải đâm trên đường về nhà! Nhưng khi tỉnh lại, cô ấy phát hiện ra rằng mình đang ở trong cơ thể của chính nữ công tước và đã được dịch chuyển trở lại phần đầu của cuốn tiểu thuyết. Đã biết Eloise sẽ đi trên con đường nào, Dakyung đang rất muốn thay đổi số phận của mình và sống sót cho đến phần ba. Thật may mắn cho cô, một Caien lúc bé đã rơi vào tay cô, và cô sẽ làm bất cứ điều gì cần thiết để giữ anh ta ở bên mình",//st.nettruyenup.com/data/comics/102/nu-cong-tuoc-phuong-bac-la-mot-nhan-vat-6940.jpg,https://www.nettruyenup.com/truyen-tranh/nu-cong-tuoc-phuong-bac-la-mot-nhan-vat-phan-dien-65126
"Sai rồi, sếp tây nhà tôi không phải là quý ông đâu!",Chapter 90,"Thể loại:Drama, Josei, Manga, Mature, Romance, Smut",Tình trạng:Đang tiến hành,Bình luận:717,Tác giả:Meg,Những nụ hôn nồng cháy và dịu dàng của anh ấy làm tôi tan chảy…. Tôi không ngờ sếp tây nhà tôi lại giỏi trong chuyện đó như vậy!!,//st.nettruyenup.com/data/comics/251/sai-roi-sep-tay-nha-toi-khong-phai-la-qu-6739.jpg,https://www.nettruyenup.com/truyen-tranh/sai-roi-sep-tay-nha-toi-khong-phai-la-quy-ong-dau-294350
Khế ước của nữ công tước quái vật,Chapter 150,Tác giả:Mộc Thiên Linh,Lượt xem:14M,Theo dõi:78K,Tình trạng:Hoàn thành,"Cuộc sống của Leslie luôn được sử dụng để cải thiện chị gái của cô - Eli. Sau khi thất bại trong việc trích xuất ma thuật bóng tối trong Leslie để chuyển cho Eli, Leslie gõ cửa nữ công tước quái vật và cầu xin nữ công tước nhận nuôi cô?!Ko đăng lại ở web, app nào khác!",//st.nettruyenup.com/data/comics/133/khe-uoc-cua-nu-cong-tuoc-quai-vat-2717.jpg,https://www.nettruyenup.com/truyen-tranh/khe-uoc-cua-nu-cong-tuoc-quai-vat-221524
Tales Of Reincarnation In Maydare,Chapter 31,"Thể loại:Adventure, Chuyển Sinh, Comedy, Drama, Fantasy, Historical, Manga, Romance",Tình trạng:Đang tiến hành,Bình luận:708,Tác giả:Yuuma Midori,"Makia là một phụ nữ quý tộc xuất thân từ một phù thủy khét tiếng. Thor, một cậu bé được nuôi dưỡng cùng cô và đến từ một thế giới khác, được chọn làm hiệp sĩ của ""vị cứu tinh"". Hai người bị buộc phải xa nhau và để gặp lại Thor một lần nữa, Makia đặt mục tiêu trở thành học sinh hàng đầu tại Trường học Phép thuật!",//st.nettruyenup.com/data/comics/116/tales-of-reincarnation-in-maydare.jpg,https://www.nettruyenup.com/truyen-tranh/tales-of-reincarnation-in-maydare-272520
Tình Địch Quái Gở Lại Tăng Thêm Rồi,Chapter 63,Tình trạng:Đang tiến hành,Bình luận:3.455,Ngày cập nhật:03/09/22,Lượt xem:5.405K,"Bạn muốn vượt qua kẻ ác để thoát khỏi cái chết một cách bình thường, nhưng tại sao nam chính và nữ chính lại cãi nhau? Đối tượng mà họ giành được có phải là tôi không? Tình địch quái gở lại tăng thêm rồi!",//st.nettruyenup.com/data/comics/138/tinh-dich-quai-go-lai-tang-them-roi.jpg,https://www.nettruyenup.com/truyen-tranh/tinh-dich-quai-go-lai-tang-them-roi-454500
Tình Bạn Giữa Công Tước Và Hầu Tước Không Hề Tồn Tại,Chapter 5,Tình trạng:Đang tiến hành,Bình luận:36,Ngày cập nhật:02/09/22,Lượt xem:26K,"Vào một ngày yên bình, thử thách đầu tiên của cô đã ở ngay trước mắt Cô phải đến tham dự sự kiện “lời thề cam kết trung thành” và gặp một hoàng tử tầm tuổi mình thay cho người anh sinh đôi bị ốm của mình – Ordo “Con không đi đâu! Tại sao con phải giả làm Ordo cơ chứ?” “Nè, Ovette. Mẹ sẽ mua cho con cái kính thiên văn mà lần trước con muốn nha?” “Mẹ à…con sẽ là bản sao hoàn hảo của Ordo” Ovette đã bước vào hoàng cung với tâm thế sẵn sàng. Và ở đấy, cô đã dính líu đến một kẻ kì lạ thậm chí còn không phải là hoàng tử đó Dù sao thì cũng không thể gặp lại nhau thêm nào nữa nên cô cùng không để ý… Ta là con trai duy nhất của đại công tước Rehovem, sao lại làm bạn với một người như thế “Dạ…?” Không hiểu sao cô lại có linh cảm sẽ vướng phải drama gì đấy với Hen Revohem “Chúc ngươi những điều tốt nhất trong tương lai, tương lai của Alphonse” Khoan đã! Tình bạn giữa đại công tước và hầu tước đâu rồi?",//st.nettruyenup.com/data/comics/104/tinh-ban-giua-cong-tuoc-va-hau-tuoc-khon-9016.jpg,https://www.nettruyenup.com/truyen-tranh/tinh-ban-giua-cong-tuoc-va-hau-tuoc-khong-he-ton-tai-68712
Gã cầu thủ lạc lối,Chapter 47,"Thể loại:Drama, Manga, Romance, Seinen, Slice of Life, Sports",Tình trạng:Đang tiến hành,Bình luận:128,Tác giả:Kusaba Michiteru,"Một người đàn ông bị mất trí nhớ và không thể nhớ được mình đến từ đâu, là ai, đến tên của mình cũng mù tịt. Anh ta sống với cái tên Matsumoto và thứ duy nhất anh ấy nhớ là cách chơi bóng (đá). Tuy nhiên, anh ta giỏi chơi bóng một cách điên rồ, thậm chí còn giỏi hơn những cầu thủ chuyên nghiệp. Anh ta ""bán"" những kỹ năng chơi bóng ảo diệu của mình cho các đội bóng và đảm bảo họ sẽ có những bàn thắng, và, thứ quan trọng nhất, chiến thắng. Với hy vọng sẽ lấy lại được trí nhớ của mình, anh chu du từ thành phố này sang thành phố khác, đất nước này sang đất nước khác để chơi bóng vì tiền.Factos 👍👀: lão người đại diện khá là não to, chiến thần thao túng, chúa tể đàm phán, vị chúa của khẩu hiệu ""Tính cả rồi"".",//st.nettruyenup.com/data/comics/2/ga-cau-thu-lac-loi.jpg,https://www.nettruyenup.com/truyen-tranh/ga-cau-thu-lac-loi-63490
Radiation House,Chapter 80,Tình trạng:Đang tiến hành,Bình luận:251,Ngày cập nhật:01/09/22,Lượt xem:667K,"Bên cạnh những y bác sĩ bạn tiếp xúc trong bệnh viện, còn có những con người cống hiến thầm lặng ít khi được tôn vinh. Họ là ai? Xin mời các bạn đến với ""Radiation House"", nơi chứa đựng những câu chuyện muôn màu muôn vẻ về các kĩ thuật viên X-quang. Mỗi ca bệnh là mỗi cung bậc cảm xúc và vô vàn kiến thức hữu ích!",//st.nettruyenup.com/data/comics/114/radiation-house.jpg,https://www.nettruyenup.com/truyen-tranh/radiation-house-234100
Ta Đã Từng Mong Nàng Biến Mất,Chapter 44,"Thể loại:Cổ Đại, Drama, Manhwa, Mystery, Ngôn Tình, Romance, Truyện Màu, Webtoon",Lượt xem:4.268K,Theo dõi:54K,Tình trạng:Đang tiến hành,"Đức vua Carloy là một người rất căm ghét Hoàng hậu Yvonne. Nhiều đến nỗi ba lần một ngày, ngài mong hoàng hậu hãy biến đi cho rồi! ""Ta không thích khuôn mặt của người phụ nữ đó, khuôn mặt giống y hệt như Công tước Delois, kẻ thù truyền kiếp của ta. Nhưng dù ta có xúc phạm nàng ấy như thế nào đi chăng nữa thì tính cách thờ ơ và xa cách của nàng ấy vẫn không hề thay đổi. Điều đó càng làm ta cảm thấy phát điên. Giờ nếu nàng ấy có bỗng nhiên mất tích hoặc chết quách đi thì ta cũng chẳng quan tâm đâu. Ta vẫn sẽ ổn dù chuyện gì có xảy ra đi nữa, miễn là ta không phải nhìn thấy khuôn mặt của nàng ấy."" Nhưng vào ngày mà Đức vua không còn mong muốn điều đó xảy ra, thì nó lại trở thành sự thật!",//st.nettruyenup.com/data/comics/136/ta-da-tung-mong-nang-bien-mat.jpg,https://www.nettruyenup.com/truyen-tranh/ta-da-tung-mong-nang-bien-mat-451920
Thần Bẫy được triệu hồi sang dị giới: Kẻ săn anh hùng,Chapter 12,"Thể loại:Action, Adventure, Anime, Comic, Drama, Fantasy, Manga, Romance, Shounen, Supernatural, Tragedy",Tình trạng:Đang tiến hành,Bình luận:1.616,Tác giả:Wadapen,"Echizen, một nhà phát triển trò chơi được biết đến là kẻ tạo ra ''những trò chơi khó nhất thế giới'' đến mức gần như không thể hoàn thành, đã tự mình giành được danh hiệu ""Thần Bẫy"". Tuy nhiên, anh xin nghỉ việc rời công ty khi anh ấy không được phép làm những gì anh ấy giỏi nhất là '' Xây dựng bẫy'' . Số phận của anh ta sau đó có một bước ngoặt bất ngờ khi anh ta được chuyển sinh sang một thế giới khác, được mô tả bằng từ hai chữ ""địa ngục"". Anh gặp con gái của quỷ vương và tìm được sức mạnh của mình, biến anh thành một ""Kẻ đánh bẫy thần"" thực sự và đi săn những anh hùng . Từ đó hành trình của kẻ phản diện độc ác  trong thế giới mới này mà anh ta coi là thiên đường  bắt đầu.để theo dõi truyện vào : fb.com/hikkiteam",//st.nettruyenup.com/data/comics/211/than-bay-duoc-trieu-hoi-sang-di-gioi-ke-8251.jpg,https://www.nettruyenup.com/truyen-tranh/than-bay-duoc-trieu-hoi-sang-di-gioi-ke-san-anh-hung-265790
Planetes,Chapter 4,Tình trạng:Đang tiến hành,Bình luận:16,Ngày cập nhật:31/08/22,Lượt xem:4.166,giới thiệu sau,//st.nettruyenup.com/data/comics/148/planetes.jpg,https://www.nettruyenup.com/truyen-tranh/planetes-114120
Succubus Iinchou ni Okotowari sa Remashite,Chapter 13,"Thể loại:Comedy, Drama, Ecchi, Psychological, School Life, Supernatural",Tình trạng:Đang tiến hành,Bình luận:237,Tác giả:Edo,,//st.nettruyenup.com/data/comics/22/succubus-iinchou-ni-okotowari-sa-remashi-3935.jpg,https://www.nettruyenup.com/truyen-tranh/succubus-iinchou-ni-okotowari-sa-remashite-568540
Cách bảo vệ anh trai của nữ chính,Chapter 43,"Thể loại:Drama, Fantasy, Manhwa, Ngôn Tình, Psychological, Romance, Truyện Màu, Xuyên Không",Lượt xem:13M,Theo dõi:148K,Tình trạng:Đang tiến hành,"Roxana Agriche, một nhân vật phản diện phụ của phụ. ""Người cha chết tiệt của tôi đã bắt cóc em trai của nữ chính. Điều gì đang chờ đợi tới kết cục khủng khiếp từ sự báo thù của nữ chính đây? Nhưng nếu tôi có thể tránh được thì sao? Tôi sẽ bảo vệ anh ta cho đến khi anh ta có thể ra khỏi đây an toàn. Anh trai của nữ chính, Kassis Pedalian, chắc chắn sẽ nhớ ơn tôi sau này.""",//st.nettruyenup.com/data/comics/224/cach-bao-ve-anh-trai-cua-nu-chinh.jpg,https://www.nettruyenup.com/truyen-tranh/cach-bao-ve-anh-trai-cua-nu-chinh-376004
Mùa Đông Tăm Tối,Chapter 124,Tác giả:Chung na,Lượt xem:2.804K,Theo dõi:17K,Tình trạng:Đang tiến hành,"Vào đêm mùa đông tăm tối, một chàng trai bị nguyền rủa và một cô gái đã phạm tội",//st.nettruyenup.com/data/comics/88/mua-dong-tam-toi.jpg,https://www.nettruyenup.com/truyen-tranh/mua-dong-tam-toi-233840
Furuya-sensei Wa An-chan No Mono,Chapter 23,Tác giả:KASUMI Yuuko,Lượt xem:144K,Theo dõi:2.199,Tình trạng:Đang tiến hành,"Tôi đã cầu hôn một cô gái mà giữa chúng tôi còn chưa có bất kì nụ hôn nào. Thậm chí cổ đã có bạn trai !? Thầy giáo xấu tính Furuya ( nhưng thầy đẹp là được ) – một người có nhiều góc khuất,và điều đó khiến An động lòng. Cô cố gắng tiếp cận mặc cho bức tường ngăn cách thầy ấy dựng nên. Một câu chuyện thú zị!",//st.nettruyenup.com/data/comics/187/furuya-sensei-wa-an-chan-no-mono.jpg,https://www.nettruyenup.com/truyen-tranh/furuya-sensei-wa-an-chan-no-mono-367950
Oujo Denka Wa Oikari No You,Chapter 19,"Thể loại:Drama, Fantasy, Manga",Tình trạng:Đang tiến hành,Bình luận:307,Tác giả:Yotsuba Neko - Nagishiro Mito,"Pháp sư vĩ đại nhất, Công chúa Leticiel, đã mất mạng trong một cuộc chiến và truyền đi một ngàn năm vào tương lai. Tức giận vì sự hồi quy của Mag Magecraft, trong thế giới đó, Leticiel bắt đầu phát triển nó, khiến cho môi trường xung quanh cô mất tinh thần. Tuy nhiên, hành động của cô sẽ sớm khiến cô và những người cô biết có liên quan đến một âm mưu nào đó.",//st.nettruyenup.com/data/comics/175/oujo-denka-wa-oikari-no-you.jpg,https://www.nettruyenup.com/truyen-tranh/oujo-denka-wa-oikari-no-you-250070
Các dự án thần tượng trường,Chapter 45,Tình trạng:Đang tiến hành,Bình luận:59,Ngày cập nhật:26/08/22,Lượt xem:69K,"Các dự án thần tượng trường được thiết lập tại một trường giữa Akihabara, Kanda, và Jinbouchou khu phố Tokyo. Các trường phải đối mặt với nguy cơ bị sắp xếp hợp lý ra khỏi sự tồn tại, vì vậy chín sinh viên nữ của mình quyết định trở thành thần tượng để bảo vệ trường học của họ và thúc đẩy tham dự.",//st.nettruyenup.com/data/comics/135/cac-du-an-than-tuong-truong.jpg,https://www.nettruyenup.com/truyen-tranh/cac-du-an-than-tuong-truong-93510
Tenohira Size,Chapter 8,Tác giả:Tendou Kirin,Lượt xem:4.441,Theo dõi:264,Tình trạng:Đang tiến hành,"Sơ lược: Chuyện kể về nhà Onishi không có người đàn ông trong nhà,không có nhiều tiền,thậm chí còn không có bồn tắm.Nhưng cả nhà vẫn rất vui vẻ và hạnh phúc ^_^... Đọc truyện mà thấy ấm lòng...",//st.nettruyenup.com/data/comics/152/tenohira-size.jpg,https://www.nettruyenup.com/truyen-tranh/tenohira-size-106480
Phương Pháp Ngăn Bạo Chúa Hắc Hoá,Chapter 38,"Thể loại:Cổ Đại, Drama, Manhwa, Ngôn Tình, Romance, Truyện Màu, Xuyên Không",Lượt xem:972K,Theo dõi:25K,Tình trạng:Đang tiến hành,"Khi quay ngược về quá khứ, tôi đã có được khả năng “ăn” những giấc mơ.Đó là một khả năng hoàn hảo để cứu hoàng đế khỏi những cơn ác mộng và bị hắc hoá.Mà chính gia tộc Harts đã gieo rắc cơn ác mộng cho hoàng đế,Mọi chuyện cũng không có gì, ngoại trừ việc gia tộc đó là gia đình của tôi.Trở thành một nhân vật phụ của gia đình Blackmak, nhiều lần tôi mong muốn được giết chết bởi một vị hoàng đế giận dữ.Trong kiếp này, để được sống, tôi che giấu thân phận của mình và cố gắng tự mình cứu hoàng đế.Này…!“Ngài có tin vào Đạo không?!”Cách mà tôi cố tiếp cận ngài ấy khi vô tình bắt gặp nhau giữa đường có thể hơi kỳ lạ, nhưng …“Ta thấy choáng váng, ác mộng đang tìm đến ta, những giấc mơ cứ liên tục hành hạ ta mà ta lại không thể nhớ về chúng, cứ như bóng tối đã nuốt chửng chúng vậy?! ”“Liệu nó có trở nên tốt hơn nếu ngài tin vào những điều đó…?”",//st.nettruyenup.com/data/comics/174/phuong-phap-ngan-bao-chua-hac-hoa.jpg,https://www.nettruyenup.com/truyen-tranh/phuong-phap-ngan-bao-chua-hac-hoa-544478
Đế Chế Diệt Vong,Chapter 30.5,Tác giả:Yoruhashi,Lượt xem:1.783K,Theo dõi:20K,Tình trạng:Đang tiến hành,"Con người từ xưa đã sống dưới sự bảo hộ của phù thủy, họ tôn kính, biết ơn và đồng thời cũng cảm thấy ... KHIẾP SỢ trước năng lực của các phù thủy. Con người muốn nổi dậy, muốn chứng minh rằng thế giới hiện nay là do họ làm chủ ... Họ truy lùng, tận diệt các phù thủy còn sót lại cho đến kẻ cuối cùng. Nhưng nhân loại không ngờ rằng, ở đâu đó có một thiếu niên là con người nhưng lại được cứu giúp và cưu mang bởi phù thủy, chứng kiến cảnh người mình yêu thương bị chính chủng tộc mình sát hại tàn nhẫn, liệu cậu thiếu niên kia sẽ làm gì để trả thù?",//st.nettruyenup.com/data/comics/230/de-che-diet-vong-5729.jpg,https://www.nettruyenup.com/truyen-tranh/de-che-diet-vong-22246
Ookami to Koushinryou,Chapter 100,"Thể loại:Adventure, Drama, Fantasy, Historical, Manga, Romance, Seinen, Slice of Life",Tình trạng:Đang tiến hành,Bình luận:458,Tác giả:HASEKURA Isuna - AYAKURA Juu - KOUME Keito,"Cốt truyện xoay quanh một thương gia trẻ tên Kraft Lawrence buôn bán dạo khắp nơi với mục tiêu là kiếm đủ tiền để mở một cửa hiệu của riêng mình và tại một ngôi làng nọ anh đã kết bạn với một sói thần tên Holo dược biết đến như nữ thần của vụ mùa, cô muốn trở về quê nhà tại Yoitsu và nghĩ rằng Lawrence sẽ đi qua đó một ngày nào đó nên cô đã cùng chàng thương nhân trẻ này bắt đầu chuyến hành trình dài đi qua nhiều thành phố khác nhau, khi Holo mang lại may mắn cho các chuyến giao thương của Lawrence thì Lawrence bảo vệ cô khỏi sự truy đổi của giáo hội.",//st.nettruyenup.com/data/comics/239/ookami-to-koushinryou.jpg,https://www.nettruyenup.com/truyen-tranh/ookami-to-koushinryou-112470
