titles,lastest_Chap,types,views,follows,condition,discription,teasers,links 
Những Câu Chuyện Huyền Bí,Chapter 93,Tình trạng:Đang tiến hành,Bình luận:530,Ngày cập nhật:8 ngày trước,Lượt xem:1.058K,"Tên khác: Monster Tale, MonStory Một thanh niên đi mua Porn gặp phải một ma cà rồng, thấy xinh quá thì cho hút máu Sau đó đời thanh niên bước sang trang mới từ đây, theo cả hướng tốt lẫn xấu Chuyển thể từ Light Novel nổi tiếng cùng tên, kết hợp cùng với nét vẽ tuyệt vời của Oh Yeah! (Tác giả của Air Gear)",//st.nettruyenup.com/data/comics/242/nhung-cau-chuyen-huyen-bi.jpg,https://www.nettruyenup.com/truyen-tranh/nhung-cau-chuyen-huyen-bi-181620
Kijin Gentoushou,Chapter 11,"Thể loại:Action, Drama, Historical, Manga, Seinen, Supernatural",Tình trạng:Đang tiến hành,Bình luận:203,Tác giả:Nakanishi Motoo,"Trong thời kỳ Edo, có một nàng vu nữ tên là ""Itsuki-hime"" sống trong bản làng Kandono và Jinta - một chàng trai trẻ có vai trò là người bảo vệ cho vị vu nữ ấy khỏi những yêu ma quỷ quái có ý đồ muốn nhắm tới cô. Khi họ chạm trán với một con quỷ bí ẩn trong khu rừng nơi cả hai đã từng đánh bại nói kẻ đã tuyên bố đã nhìn thấy một tương lai xa từ thời Edo đến thời đại Heisei. Đây là bộ truyện giả tưởng kể về hành trình xuyên thời gian khi Jinta liên tục bị đặt câu hỏi về ý nghĩa của việc sử dụng thanh kiếm và việc trở thành một con quỷ hay trở thành một con người là lựa chọn đúng đắn nhất.",//st.nettruyenup.com/data/comics/126/kijin-gentoushou.jpg,https://www.nettruyenup.com/truyen-tranh/kijin-gentoushou-74878
Ngày Ấy Các Người Gọi Chúng Tôi Là Quỷ Dữ,Chapter 4,"Thể loại:Drama, Manga, Mature, Mystery, Psychological, School Life, Shounen, Supernatural, Tragedy",Tình trạng:Đang tiến hành,Bình luận:64,Tác giả:Sano Takashi,"Yusuke là một học sinh cao trung hoàn toàn bình thường, dù cho ký ức của cậu chỉ còn là tờ giấy trắng sau một vụ mất tích. Ngày tháng bình yên tiếp diễn, cho đến khi những người tự nhận mình là nạn nhân của Yusuke trong quá khứ xuất hiện…  Trong sự hoang man và ngờ vực đó, Yusuke nhận ra rằng, quãng thời gian mà cậu mất tích là mấu chốt quan trọng để cậu giải mã những bí ẩn trong quá khứ…",//st.nettruyenup.com/data/comics/34/ngay-ay-cac-nguoi-goi-chung-toi-la-quy-d-5723.jpg,https://www.nettruyenup.com/truyen-tranh/ngay-ay-cac-nguoi-goi-chung-toi-la-quy-du-79394
Change (JinYuan) SS2,Chapter 54.1,Tác giả:JinYuan,Lượt xem:534K,Theo dõi:10K,Tình trạng:Đang tiến hành,Tiếp nối phần 1 của Change (JinYuan),//st.nettruyenup.com/data/comics/161/change-jinyuan-ss2-6695.jpg,https://www.nettruyenup.com/truyen-tranh/change-jinyuan-ss2-539210
Nhà Kính Lạnh Lẽo,Chapter 3,Tình trạng:Đang tiến hành,Bình luận:19,Ngày cập nhật:8 ngày trước,Lượt xem:3.134,"Trò chơi tình ái chết chóc giữa hai người đàn ông: Sejin - luôn khắc khoải tham vọng trả thù cho người cậu yêu và Gyu-ryeon - phụ tá đắc lực của phe cánh kẻ thù, đã bắt đầu cùng với thù hận tuôn trào",//st.nettruyenup.com/data/comics/185/nha-kinh-lanh-leo.jpg,https://www.nettruyenup.com/truyen-tranh/nha-kinh-lanh-leo-79545
Đưa Em Đến Mặt Trăng,Chapter 27,Tình trạng:Đang tiến hành,Bình luận:242,Ngày cập nhật:9 ngày trước,Lượt xem:410K,,//st.nettruyenup.com/data/comics/84/dua-em-den-mat-trang.jpg,https://www.nettruyenup.com/truyen-tranh/dua-em-den-mat-trang-74580
Bồi Hồi Giả,Chapter 17,"Thể loại:Drama, Horror, Manga, Psychological, Seinen",Tình trạng:Đang tiến hành,Bình luận:457,Tác giả:Suzuki Yuhei - Takarai Hakaru,"Mang trên mình hình dạng của một người đàn ông kỳ lạ ăn mặc như một nhân viên soát vé lang thang khắp các nhà ga và bên trong xe điện. Tất cả những ai nhìn thấy hình dạng của người đàn ông không rõ danh tính này cũng đều sẽ nhận một cái chết thảm thương dưới cây kéo lớn mà hắn ta đang cầm!! Tsukiko, một nữ sinh viên đại học vốn đang trải qua một đời sinh viên giản dị cùng người yêu của mình là Shu, cũng có thể nhìn thấy hắn...!",//st.nettruyenup.com/data/comics/127/boi-hoi-gia.jpg,https://www.nettruyenup.com/truyen-tranh/boi-hoi-gia-69503
Himegoto - Juukyuusai no Seifuku,Chapter 20,Tác giả:Minenami Ryo,Lượt xem:961K,Theo dõi:5.314,Tình trạng:Đang tiến hành,"Một cô nàng tomboy khao khát được trở nên nữ tính, bí mật mặc chiếc váy đồng phục cũ và tưởng tượng có người đàn ông hành hạ mình để th* d*m.Một cô gái đáng yêu và ngây thơ có vẻ ngoài trẻ hơn tuổi, sử dụng vẻ ngoài đó để kiếm tiền từ việc ""đón khách"" từ năm 15.Một chàng trai nổi tiếng và được yêu mến, sử dụng tiền của bạn gái để mua trang phục nữ và khao khát được chấp nhận xxx khi ""là một cô gái"".Một mối tình tay ba vô cùng kì lạ....",//st.nettruyenup.com/data/comics/129/himegoto-juukyuusai-no-seifuku.jpg,https://www.nettruyenup.com/truyen-tranh/himegoto-juukyuusai-no-seifuku-101130
The Negative Hero and the Chief of the Demon Army,Chapter 26,"Thể loại:Adventure, Comedy, Drama, Fantasy, Manga, Slice of Life",Lượt xem:1.175K,Theo dõi:13K,Tình trạng:Đang tiến hành,Một bé anh hùng tội nghiệp được quỷ vương đem về nuôi,//st.nettruyenup.com/data/comics/33/the-negative-hero-and-the-chief-of-the-d-7993.jpg,https://www.nettruyenup.com/truyen-tranh/the-negative-hero-and-the-chief-of-the-demon-army-200010
Fate/Grand Order: Epic of Remnant - Salem,Chapter 22,"Thể loại:Action, Drama, Mystery, Seinen, Shounen, Supernatural",Lượt xem:107K,Theo dõi:1.304,Tình trạng:Đang tiến hành,"Dị Điểm Á Chủng cuối cùng trong 4 Dị Điểm Á Chủng trong tác phẩm Fate/Grand Order. Salem, vùng đất dị giáo đầy huyền bí nhưng không kém phần... hài hước, khép lại giai đoạn thứ 2 của Grand Order, chuẩn bị bước qua thời kỳ mới của các thành viên Chaldea...",//st.nettruyenup.com/data/comics/154/fategrand-order-epic-of-remnant-salem.jpg,https://www.nettruyenup.com/truyen-tranh/fategrand-order-epic-of-remnant-salem-211460
"Gửi Em, Người Nuốt Trọn Vì Sao",Chapter 105.2,Tác giả:Xóm Ngôn Lù,Lượt xem:228K,Theo dõi:3.862,Tình trạng:Đang tiến hành,"Khi Jiu Seo chuyển ra khỏi biệt thự của người bạn thời thơ ấu và dọn vào một căn hộ nhỏ chỉ có một phòng, cô nghĩ rằng thế giới của mình đã kết thúc - Nhưng, cho đến khi cô gặp Hajun và Hayul, những đứa trẻ bị bỏ rơi sống ở tầng dưới. Khi một lời đề nghị tuyển thực tập sinh đến để mời Hajun tham gia một chương trình sống còn của một idol, Jiu đã khuyến khích cậu bé đi thử giọng, cô hoàn toàn không biết điều đó sẽ làm thay đổi quỹ đạo cuộc sống của mình và mọi người mãi mãi. Cập nhật sớm nhất tại https://fecomic.com/comic/gui-em-nguoi-nuot-tron-vi-sao",//st.nettruyenup.com/data/comics/249/gui-em-nguoi-nuot-tron-vi-sao.jpg,https://www.nettruyenup.com/truyen-tranh/gui-em-nguoi-nuot-tron-vi-sao-486330
Honzuki no Gekokujou : Dai 3-bu Ryouchi ni hon o hirogeyou !,Chapter 34,Tác giả:KAZUKI Miya - Namino Ryo,Lượt xem:124K,Theo dõi:3.169,Tình trạng:Đang tiến hành,"Manga Phần 3 của Honzuki no Gekokujou*Lưu ý: End của Anime ss2 chỉ mới đến 1 nửa Phần 2 của LN/Manga ! Urano đã tái sinh ở thế giới mới (Isekai). Bản thân là 1 con mọt sách, cô sẽ làm gì trong 1 thế giới mới nơi sách là thứ đắt đỏ ? Hành trình của cô từ đó được bắt đầu dưới 1 thân phận mới, 1 cái tên mới là Myne. Bằng nỗ lực của mình cô cùng những con người nơi đây từng bước tiến về tương lai.",//st.nettruyenup.com/data/comics/122/honzuki-no-gekokujou-dai-3-bu-ryouchi-ni-6873.jpg,https://www.nettruyenup.com/truyen-tranh/honzuki-no-gekokujou-dai-3-bu-ryouchi-ni-hon-o-hirogeyou-66682
Bạn gái của tôi rất kì lạ,Chapter 54,Tác giả:Ẩn anh,Lượt xem:820K,Theo dõi:13K,Tình trạng:Đang tiến hành,"Xuất hiện trước mặt A Bắc đang bị mất trí nhớ, là một cô gái xinh đẹp tên là Tô Mặc, nhưng bên trong cơ thể của Tô Mặc còn có những nhân cách khác, vấn đề đặt ra trước mắt của A Bắc chính là, nếu muốn qua lại với nhau bình thường, dường như phải am hiểu hết tất cả mọi nhân cách của cô ấy mới được.",//st.nettruyenup.com/data/comics/148/ban-gai-cua-toi-rat-ki-la-424.jpg,https://www.nettruyenup.com/truyen-tranh/ban-gai-cua-toi-rat-ki-la-71828
Madk,Chapter 19.5,Tình trạng:Đang tiến hành,Bình luận:228,Ngày cập nhật:9 ngày trước,Lượt xem:47K,"Makoto là một người kì dị với sở thích có phần quái gở đã triệu hồi một Đại thân vương của quỷ giới – J và đồng ý giao kết trao linh hồn mình cho J để đổi lại, hắn sẽ thực hiện mong muốn của cậu.",//st.nettruyenup.com/data/comics/29/madk.jpg,https://www.nettruyenup.com/truyen-tranh/madk-78109
Trở Lại Thời Kì Đồ Đá,Chapter 79,"Thể loại:Action, Adventure, Drama, Historical, Manga, Martial Arts, Mature, Mystery, Seinen, Supernatural",Tình trạng:Đang tiến hành,Bình luận:1.451,Tác giả:Kouji Mori - MORI Kouji,"Một câu chuyện về một chàng trai thiếu cảm giác thực tế sau khi bị người yêu bỏ rơi. Anh ta đang tham dự một hội thảo về nhân chủng học văn hóa với các bạn cùng lớp khi anh ta phát hiện ra một bức tranh tường cổ, đưa anh ta về quá khứ nơi voi ma mút thống trị thế giới. Đồng tác giả với siêu phẩm: Đảo tự sát",//st.nettruyenup.com/data/comics/173/tro-lai-thoi-ki-do-da.jpg,https://www.nettruyenup.com/truyen-tranh/tro-lai-thoi-ki-do-da-288450
"Tôi Sắp Ly Hôn Với Người Chồng Độc Ác, Nhưng Chúng Tôi Có Baby",Chapter 42,"Thể loại:Drama, Manhwa, Ngôn Tình, Truyện Màu",Lượt xem:3.002K,Theo dõi:55K,Tình trạng:Đang tiến hành,"Không hoàn toàn đúng 100% Tôi đã sở hữu cơ thể của một người phụ nữ sẽ kết hôn với ác ma. Trong một vai diễn bị ám ảnh bởi chồng mình đến khi chết. “Tôi sẽ luôn ở bên cạnh ngài!” Tôi đã quyết định sẽ đối xử tốt với người chồng tội nghiệp này trong một thời gian. Nhưng trước một ngày, khi tôi đã đến tuổi trưởng thành và dự định ly hôn. Một thiên thần nhỏ đã xuất hiện trong đêm đầy bất ngờ. Trời ạ. Vậy nên tôi đã cố gắng chạy trốn trước khi bị phát hiện… “Richard? có gì đó không được ổn…” “Ta không có ý định để em chạy trốn, cho dù em có chết đi thì cũng phải ở trong vòng tay của ta. Elisha à” Cố gắng khóc lóc van xin với khuôn mặt xinh đẹp cũng không thể. “Em định đưa con của chúng ta đi đâu?” Anh ta thậm chí còn đuổi theo tôi với ánh mắt đầy lạnh lẽo đó? …Tôi đoán mình đã sai khi chạy trốn như này. Phải giải quyết tình huống này ra sao đây?",//st.nettruyenup.com/data/comics/9/toi-sap-ly-hon-voi-nguoi-chong-doc-ac-nh-4097.jpg,https://www.nettruyenup.com/truyen-tranh/toi-sap-ly-hon-voi-nguoi-chong-doc-ac-nhung-chung-toi-co-baby-70665
An Easy Introduction to Love Triangles,Chapter 8.5,"Thể loại:Comedy, Drama, Manga, Romance, School Life, Seinen, Slice of Life, Soft Yuri",Tình trạng:Đang tiến hành,Bình luận:44,Tác giả:Canno,"Nữ sinh Mayuki muốn đậu vào trường Ohtomo, nơi đàn chị yêu quý Akira đang theo học. Nhưng có một vấn đề là thành tích học tập của cô rất kém. Thế là mẹ của Mayuki đã thuê gia sư đến dạy học. Bất ngờ thay, gia sư đó chính là nữ sinh tên Rin đang theo học tại Ohtomo. Nhưng Mayuki đã yêu cầu Rin dạy cho cô những thứ khác ngoài các môn học...",//st.nettruyenup.com/data/comics/114/an-easy-introduction-to-love-triangles.jpg,https://www.nettruyenup.com/truyen-tranh/an-easy-introduction-to-love-triangles-454260
Mato Seihei No Slave,Chapter 102,"Thể loại:Action, Adventure, Drama, Fantasy, Manga, Shounen",Tình trạng:Đang tiến hành,Bình luận:5.933,Tác giả:Takahiro,Kể về những cuộc chiến chống lại những con quỷ ở trong Ma đô (Thành phố ma thuật). Cùng tác giả với Akame ga Kill,//st.nettruyenup.com/data/comics/196/mato-seihei-no-slave.jpg,https://www.nettruyenup.com/truyen-tranh/mato-seihei-no-slave-206760
Anh Hùng Bóng Tối Mạnh Nhất - Những Thành Viên Trong Đội Đã Phản Bội Tôi,Chapter 24,"Thể loại:Action, Adventure, Drama, Fantasy, Manga, Romance, Supernatural",Tình trạng:Đang tiến hành,Bình luận:1.200,Tác giả:Seto Meguru,"Nội Dung Anh Hùng Bóng Tối Mạnh Nhất - Những Thành Viên Trong Đội Đã Phản Bội Tôi Nên Tôi Sẽ Đồng Hành Cùng Con Quái Vật Mạnh Nhất: Anh hùng bóng tối Shion, người được xem là anh hùng mạnh nhất trên thế giới, luôn tin tưởng vào những người đồng đội của mình. “Với tổ đội này, ta sẽ đánh bại quỷ vương!” Shion đã thề là sẽ làm như vậy, nhưng một bị kịch đã xảy ra. Thật đau đớn là anh lại bị những cô gái mà mình tin tưởng phản bội. Mặc dù anh ta vẫn giữ được mạng sống của mình, nhưng sự việc lần đó đã để lại một vết thương sâu trong lòng Shion. Shion không muốn phải sống thêm nữa, nhưng trong lúc anh ta đang đi lang thang trong rừng, tìm một cách để chết thì đột nhiên một con quái vật xuất hiện trước mặt Shion. “Xin ngươi hãy giết ta đi.” Con quái vật cầu xin Shion giết nó, bởi vì anh ta vẫn còn rất mạnh cho dù đã mất đi năng lực của mình. Điều mà Shion, kẻ cũng đang muốn chết, đã làm là…",//st.nettruyenup.com/data/comics/205/anh-hung-bong-toi-manh-nhat-nhung-thanh-3624.jpg,https://www.nettruyenup.com/truyen-tranh/anh-hung-bong-toi-manh-nhat-nhung-thanh-vien-trong-doi-da-phan-boi-toi-219650
Verndio - Sử thi về mộng kiếm,Chapter 43,Tác giả:Nanao Nanaki,Lượt xem:735K,Theo dõi:8.867,Tình trạng:Đang tiến hành,"Hậu truyện của Helck Manga. Kể về một anh chàng lính đánh thuê đen đủi muốn một cuộc sống yên bình, nhưng số phận của anh lại nói không",//st.nettruyenup.com/data/comics/196/verndio-su-thi-ve-mong-kiem.jpg,https://www.nettruyenup.com/truyen-tranh/verndio-su-thi-ve-mong-kiem-60612
Mẹ của tôi không phải là con người,Chapter 3,Tác giả:Usamiya Mame,Lượt xem:84K,Theo dõi:2.104,Tình trạng:Đang tiến hành,"Cô gái khi về nhà thì phát hiện ra mẹ của mình không phải là con người. Thế nhưng, người mẹ mới này lại không đối xử tệ bạc với cô như người mẹ trước...",//st.nettruyenup.com/data/comics/41/me-cua-toi-khong-phai-la-con-nguoi.jpg,https://www.nettruyenup.com/truyen-tranh/me-cua-toi-khong-phai-la-con-nguoi-79657
Cross and Crime,Chapter 84,Tình trạng:Đang tiến hành,Bình luận:1.095,Ngày cập nhật:10 ngày trước,Lượt xem:7.547K,"Tokano Yuuka đang quen dần với cuộc sống khi bạn trai cô, Yazaki Norikazu một phóng viên bị điều đi công tác xa. Thật tình cờ Yazaki lại là bạn thân của ngôi sao ca nhạc nổi tiếng nhất hiện nay mà Yuuka vô cùng mến mộ, Saeki Keito. Trong một lần đi phỏng vấn, cô được bạn trai đưa đến gặp thần tượng của mình. Tuy nhiên, điều mà Yuuka lại không ngờ được chính là việc Keito không hề hoàn hảo, tuyệt vời như vẻ ngoài anh ta thể hiện. Và chính khoảnh khắc đó, cô đã bị rơi vào một trò chơi tội lỗi không có lối thoát, khi mà chính người mình hằng ngưỡng mộ lại đang lên kế hoạch hủy hoại cô về cả thể xác và tâm hồn. Yuuka sẽ phải làm sao để đối mặt với những đe dọa, cám dỗ tay ba đầy nhục dục, đồng thời cứu vãn mối quan hệ với Yazaki, tình yêu đích thực của đời mình? Đây là trò chơi tội lỗi không chỉ của của ba người, bạn không được phép bỏ cuộc, không thể thoát ra và cũng không thể nói cùng ai...",//st.nettruyenup.com/data/comics/110/cross-and-crime.jpg,https://www.nettruyenup.com/truyen-tranh/cross-and-crime-113740
Osananajimi Kanojo no Morahara ga Hidoi n de Zetsuen Sengen Shite Yatta,Chapter 6,"Thể loại:Drama, Manga, Romance, School Life, Shounen",Tình trạng:Đang tiến hành,Bình luận:441,Tác giả:Ononata Manimani,"Bạn thuở nhỏ cũng là bạn gái của tôi, như mơ luôn nhỉ? Có cai dau buoi, em ấy chì chiết tôi ngày 3 bữa đều như ăn cơm, cô ấy nghiền lòng tự trọng của tôi ra thành cám và bdsm sức khoẻ tinh thần tôi, Tôi đành chia tay với em ấy, vì 1 tương lai ko phải đi trị liệu",//st.nettruyenup.com/data/comics/79/osananajimi-kanojo-no-morahara-ga-hidoi-4682.jpg,https://www.nettruyenup.com/truyen-tranh/osananajimi-kanojo-no-morahara-ga-hidoi-n-de-zetsuen-sengen-shite-yatta-77647
Bí Mật Của Quý Cô,Chapter 77.2,"Thể loại:Chuyển Sinh, Drama, Fantasy, Manhwa, Mystery, Ngôn Tình, Romance, Truyện Màu, Webtoon, Xuyên Không",Lượt xem:1.890K,Theo dõi:23K,Tình trạng:Đang tiến hành,,//st.nettruyenup.com/data/comics/227/bi-mat-cua-quy-co.jpg,https://www.nettruyenup.com/truyen-tranh/bi-mat-cua-quy-co-680685
Tia Sáng Xinh Đẹp,Chapter 30,"Thể loại:Drama, Manga, Mystery, Psychological, School Life, Seinen",Tình trạng:Đang tiến hành,Bình luận:155,Tác giả:Nagai Saburou,"Nữ sinh trung học Nanako đã chết. Ở lớp cô bé, ai ai cũng tỏ ra buồn bã và tiếc thương, chỉ trừ 3 người: một cô nàng điên cuồng vì ngoại hình đến mức sẵn sàng quyên sinh để bảo toàn sắc đẹp; một cô nàng tuyệt vọng vì chấn thương đến mức mong được chết đi để chấm dứt khổ đau; và một cô nàng vô cảm chẳng quan tâm đến bất cứ thứ gì khác trên đời ngoại trừ cái bao tử luôn réo rít. Thế rồi Kisaragi Tamiko — người bạn cùng lớp xinh đẹp đã nghỉ học từ vài tháng trước — đột ngột tái xuất. Những hành động quái gở của Tamiko khiến cuộc sống học đường của 3 nữ sinh kia như bị đảo lộn hoàn toàn. Rốt cuộc thì Tamiko trở lại trường là vì cớ gì? Tamiko có liên quan gì đến cái chết của Nanako? Và ""thứ đang mục nát"" trong nhà Tamiko là gì?Từ đây, rồi những nhuốc nhơ trong cuộc đời của nữ sinh mới lớn: bắt nạt nhau, cha mẹ độc hại, quấy rối tình dục v.v... sẽ được phơi bày.",//st.nettruyenup.com/data/comics/135/tia-sang-xinh-dep.jpg,https://www.nettruyenup.com/truyen-tranh/tia-sang-xinh-dep-75655
Tôi Muốn Độc Chiếm Cô Bạn Gái Lạnh Lùng Của Mình,Chapter 20,"Thể loại:Drama, Manga, Romance, School Life, Slice of Life",Tình trạng:Đang tiến hành,Bình luận:677,Tác giả:Sugar Amazato,Ngọt + segs + xiu xíu drama nhẹ cho ngày mới năng động :3,//st.nettruyenup.com/data/comics/17/toi-muon-doc-chiem-co-ban-gai-lanh-lung-8314.jpg,https://www.nettruyenup.com/truyen-tranh/toi-muon-doc-chiem-co-ban-gai-lanh-lung-cua-minh-74257
Tất Cả Chỉ Là Sai Lầm,Chapter 83,"Thể loại:Chuyển Sinh, Drama, Manhwa, Ngôn Tình, Truyện Màu, Xuyên Không",Lượt xem:1.132K,Theo dõi:15K,Tình trạng:Đang tiến hành,"Valrose đã tái sinh thành một vai phản diện trong một cuốn sách nọ. Để tránh số mệnh bị hỏa thiêu trên cột, cô tiếp cận người hùng, Nocton Edgar.",//st.nettruyenup.com/data/comics/236/tat-ca-chi-la-sai-lam.jpg,https://www.nettruyenup.com/truyen-tranh/tat-ca-chi-la-sai-lam-72684
Đại Tượng Vô Hình,Chapter 295,Tác giả:Phan Kỳ Động Mạn,Lượt xem:30M,Theo dõi:95K,Tình trạng:Đang tiến hành,"Nữ chính trong một lần tai nạn xe bị sinh vật bí ẩn gá vào người, sau khi tỉnh lại đến một thế giới yêu linh. Trong lúc cô ấy sợ hãi, tuyệt vọng thì xuất hiện một thiếu niên cứu cô ta về hiện thế. Thì ra thế giới này có yêu linh, sinh vật trong cơ thể cô ta là yêu linh tên ""Nhân Tiêu"", không cách nào đẩy yêu linh ra ngoài được, cùng đồng hành trên con đường trừ yêu...",//st.nettruyenup.com/data/comics/234/dai-tuong-vo-hinh.jpg,https://www.nettruyenup.com/truyen-tranh/dai-tuong-vo-hinh-258340
Vua Bóng Chuyền,Chapter 355,Tác giả:Furudate Haruichi,Lượt xem:5.113K,Theo dõi:20K,Tình trạng:Đang tiến hành,"Tên khác: Haikyuu!!; Furudate Haruichi Câu chuyện về Hinata Shouyou, Một học sinh cấp 3 yêu thích và tham gia vào 1 Câu Lạc Bộ bóng chuyền.... Không có kỹ năng nhưng có tài năng.... Hãy xem cậu ấy thể hiện nó để đi đến đỉnh cao Bóng Chuyền như thế nào đi nào!!",//st.nettruyenup.com/data/comics/207/vua-bong-chuyen.jpg,https://www.nettruyenup.com/truyen-tranh/vua-bong-chuyen-137750
"Kononaka ni hitori, ore no yome ga iru",Chapter 15,"Thể loại:Comedy, Drama, Harem, Manga, Romance, School Life, Slice of Life",Lượt xem:416K,Theo dõi:9.297,Tình trạng:Đang tiến hành,"Souya là một người đàn ông thế chỗ cho đứa em trai đột nhiên biến mất của mình, hơn nữa, anh ta phát hiện ra sự thật đáng ngạc nhiên là em trai mình có rất nhiều vợ chưa cưới?",//st.nettruyenup.com/data/comics/8/kononaka-ni-hitori-ore-no-yome-ga-iru-8444.jpg,https://www.nettruyenup.com/truyen-tranh/kononaka-ni-hitori-ore-no-yome-ga-iru-60936
Silent Miyashita-san's Sexy Channel,Chapter 4.1,"Thể loại:Adult, Drama, Ecchi, Manga, School Life, Seinen",Tình trạng:Đang tiến hành,Bình luận:247,Tác giả:Mitsudoue,"Kei Sakai là một nam sinh không có hứng thú với bất cứ thứ gì, kể cả những thứ hư hỏng. Một ngày, cậu được cho xem một tấm ảnh 18+ của một cô gái đang nổi tiếng trên mạng có tên Yami, và trùng hợp thế nào, Sakai lại nhận ra cô gái Yami này chính là người bạn cùng lớp trầm tính có tên Saki Miyashita...",//st.nettruyenup.com/data/comics/59/silent-miyashita-sans-sexy-channel.jpg,https://www.nettruyenup.com/truyen-tranh/silent-miyashita-sans-sexy-channel-73531
Kết Thúc Của Nhân Vật Phản Diện Chỉ Có Thể Là Cái Chết,Chapter 116,Tác giả:Gwon GyeoulSuol,Lượt xem:32M,Theo dõi:276K,Tình trạng:Đang tiến hành,"Penelope Eckart được tái sinh thành con gái nuôi của Công tước Eckart và là nữ nhân vật phản diện của một trò chơi hẹn hò harem ngược. Vấn đề là, khi cô ấy bước vào trò chơi với độ khó cao nhất, và dù cô ấy có làm gì đi chăng nữa, cái chết vẫn chờ cô ấy ở mọi kết thúc! Trước khi “con gái thực sự” của Công tước Eckart xuất hiện, cô phải chọn một trong những nam chính và đạt được kết thúc có hậu để sống sót. Nhưng hai anh em như những hoàng tử điên cuồng, luôn gây chiến với cô ấy từ mọi điều nhỏ nhặt, nơi  mọi con đường dẫn đến cái chết. Thậm chí truyện còn xoay quanh một pháp sư say mê nữ chính, và một hiệp sĩ nô lệ trung thành! Nhưng bằng cách nào đó, mức độ yêu thích của những nam chính càng tăng khi cô đi quá giới hạn với họ!   Đây là câu chuyện sinh tồn của Penelope, cô gái bị vướng vào một cuộc hẹn hò điên rồ với câu chuyện harem ngược!",//st.nettruyenup.com/data/comics/186/ket-thuc-cua-nhan-vat-phan-dien-chi-co-t-8708.jpg,https://www.nettruyenup.com/truyen-tranh/ket-thuc-cua-nhan-vat-phan-dien-chi-co-the-la-cai-chet-378187
