titles,lastest_Chap,types,views,follows,condition,discription,teasers,links 
Đối Tượng Tôi Công Lược Đều Là Người Trọng Sinh,Chapter 24,Tình trạng:Đang tiến hành,Bình luận:708,Ngày cập nhật:1 ngày trước,Lượt xem:832K,"Muốn thay những Nữ Phụ đang tìm đường chết mà không phải chết thì phải kết thúc cốt truyện gốc, đồng thời còn phải giúp cho ký chủ không bị coi thường, thay thế ký chủ đi trên đỉnh cao nhân sinh…….Úc Dao bày tỏ: cô ấy nên bày ra dáng vẻ mình là kiểu người sống dở chết dở, thì mới có thể đạt được đỉnh cao của nhân sinh á hả?Úc Dao: tôi ngang ngược, hống hách, bụng dạ nham hiểm, vô cùng độc ác (chống nạnh gào lên……)Nam Phụ 1: Dao Dao không hề ngang ngược độc ác giống như vẻ bề ngoài, cô ấy chỉ là một đứa trẻ vẫn chưa trưởng thành thôi, thật ra cô ấy là người có trái tim đơn thuần nhất……Nam Phụ 2: Dưới vẻ ngoài hống hách và thô lỗ của Dao Dao lại là một người có trái tim nhân hậu, cô ấy là ánh sáng, là hy vọng chiếu soi cuộc đời tăm tối của tôi…..Nam Phụ 3: Dao Dao, lần này đổi lại tôi sẽ đến bảo vệ em, tôi nguyện vì em mà đạp đổ hết những chướng ngại cản bước em……Nam Chính: Vì em, tôi có thể chống lại cả thế giới…… ……………….. Úc Dao: tôi tôi tôi, tôi đến đây là vì cốt truyện thôi, tha cho tôi đi…….",//st.nettruyenup.com/data/comics/160/doi-tuong-toi-cong-luoc-deu-la-nguoi-tro-99.jpg,https://www.nettruyenup.com/truyen-tranh/doi-tuong-toi-cong-luoc-deu-la-nguoi-trong-sinh-74400
Thử Nghiệm Nghìn Năm Cuối Cùng Trò Chơi Cũng Bắt Đầu,Chapter 10,Tình trạng:Đang tiến hành,Bình luận:246,Ngày cập nhật:1 ngày trước,Lượt xem:171K,,//st.nettruyenup.com/data/comics/56/thu-nghiem-nghin-nam-cuoi-cung-tro-choi-5521.jpg,https://www.nettruyenup.com/truyen-tranh/thu-nghiem-nghin-nam-cuoi-cung-tro-choi-cung-bat-dau-75320
"Sau Khi Bị Dũng Sĩ Cướp Đi Mọi Thứ, Tôi Đã Lập Tổ Đội Cùng Với Mẹ Của Dũng Sĩ!",Chapter 3,"Thể loại:Action, Adult, Ecchi, Fantasy, Isekai, Manga",Tình trạng:Đang tiến hành,Bình luận:1.051,Tác giả:Ishino Yassan,Bị NTR? Đi ntr lại thằng bố của nó.,//st.nettruyenup.com/data/comics/177/sau-khi-bi-dung-si-cuop-di-moi-thu-toi-d-8003.jpg,https://www.nettruyenup.com/truyen-tranh/sau-khi-bi-dung-si-cuop-di-moi-thu-toi-da-lap-to-doi-cung-voi-me-cua-dung-si-76721
Nightmare Funk,Chapter 11,Tình trạng:Đang tiến hành,Bình luận:557,Ngày cập nhật:1 ngày trước,Lượt xem:268K,"Kurusu Hiyori là một nữ cảnh sát trẻ và là con gái của một cựu cảnh sát trưởng. Cô có lời nguyền bất thường về việc có những giấc mơ tiên đoán về một vụ giết người của một người vào ngày hôm sau. Bi kịch, đầu tiên của những giấc mơ cô đã trải qua cho thấy cái chết của cha mình. Theo thời gian, những giấc mơ đã dẫn đến sự cô lập xã hội của cô và rất nhiều vấn đề trong công việc. Vào ngày sau khi cô mơ về vụ ám sát Claus Haida, một người nước ngoài đáng sợ. Cô rất vui mừng vì đã giải cứu anh ta, nhưng hóa ra anh ta là một con quái vật. Anh ta không thể phủ nhận là hữu ích, nhưng liệu Hiyori có thực sự hợp lực với một người như vậy không?",//st.nettruyenup.com/data/comics/83/nightmare-funk.jpg,https://www.nettruyenup.com/truyen-tranh/nightmare-funk-190270
The Dead King,Chapter 81.5,Tình trạng:Đang tiến hành,Bình luận:689,Ngày cập nhật:1 ngày trước,Lượt xem:1.727K,Một thanh niên với hai cuộc sống: một đội trưởng trẻ tuổi ở thế giới phép thuật và một cậu học sinh THPT ở thực tại. Và anh ấy sống cả hai cuộc sống như vậy luôn! Hãy đắm mình trong bộ truyện tranh võ thuật tổng hợp đặc sắc nhất từ trước đến giờ!,//st.nettruyenup.com/data/comics/219/the-dead-king.jpg,https://www.nettruyenup.com/truyen-tranh/the-dead-king-245390
Nhà Trọ Nhất Khắc,Chapter 108,"Thể loại:Manga, Romance, Shoujo, Slice of Life",Tình trạng:Đang tiến hành,Bình luận:144,Tác giả:Rumiko Takahashi,"Ngày nảy ngày nay, trong một xóm trọ có tên Nhất Khắc (Ikkoku), nơi đó có chàng học trò nghèo biệt danh ""thần Rớt"", một tiểu thư sexy, một gã kỳ quặc thích đục tường dòm lén, một bợm rượu tửu lượng vô đối sống chung với nhau rất hòa thuận. Một ngày nọ, có một cô gái đến và tự xưng là quản lý mới cho khu trọ. Người quản lý xinh đẹp đã khiến chàng học trò nghèo, con rơi của thần Rớt, thầm thương trộm nhớ... và câu chuyện ""cóc ghẻ đòi ăn thịt thiên nga"" được bắt đầu.",//st.nettruyenup.com/data/comics/110/nha-tro-nhat-khac.jpg,https://www.nettruyenup.com/truyen-tranh/nha-tro-nhat-khac-90700
Người Côn Trùng,Chapter 21,"Thể loại:Action, Manhwa, Truyện Màu",Lượt xem:417K,Theo dõi:11K,Tình trạng:Đang tiến hành,,//st.nettruyenup.com/data/comics/226/nguoi-con-trung.jpg,https://www.nettruyenup.com/truyen-tranh/nguoi-con-trung-78562
Nhập Hồn Ma Đạo Tổ Sư,Chapter 25.5,Tình trạng:Đang tiến hành,Bình luận:2.409,Ngày cập nhật:1 ngày trước,Lượt xem:1.680K,,//st.nettruyenup.com/data/comics/46/nhap-hon-ma-dao-to-su.jpg,https://www.nettruyenup.com/truyen-tranh/nhap-hon-ma-dao-to-su-66862
Giang Hồ Thực Thi Công Lý,Chapter 51,Tình trạng:Đang tiến hành,Bình luận:3.581,Ngày cập nhật:2 ngày trước,Lượt xem:3.302K,"Sau khi bỏ học, Kwon Daegun đang chuẩn bị cho kỳ thi năng lực của mình. Khi đang làm công việc bán thời gian trong một cửa hàng tiện lợi, anh ta đã đánh nhau với một số côn đồ. Daegun, một người dễ dàng đánh bại họ, được Tổ chức Giáo dục đề nghị một dự án mang tên “Iljin in Charge / The Bully In Charge”, tổ chức đã theo dõi sát sao anh ấy trong một thời gian dài. Anh ta, người đã chấp nhận lời đề nghị , vào một trường trung học thuộc nền tảng và đánh bại từng kẻ bắt nạt khét tiếng của trường này theo thứ tự.",//st.nettruyenup.com/data/comics/19/giang-ho-thuc-thi-cong-ly.jpg,https://www.nettruyenup.com/truyen-tranh/giang-ho-thuc-thi-cong-ly-65299
Chơi Game Cứu Nhân Loại,Chapter 6,Tình trạng:Đang tiến hành,Bình luận:113,Ngày cập nhật:2 ngày trước,Lượt xem:29K,,//st.nettruyenup.com/data/comics/168/choi-game-cuu-nhan-loai.jpg,https://www.nettruyenup.com/truyen-tranh/choi-game-cuu-nhan-loai-79272
Chế Ngự Kiếm,Chapter 50,Tình trạng:Đang tiến hành,Bình luận:1.360,Ngày cập nhật:2 ngày trước,Lượt xem:1.720K,"Nhân vật chính của truyện luôn được định trước. Dù nhân vật phụ có cố gắng bao nhiêu thì vẫn chỉ là nhân vật phụ mà thôi. Nhưng một ngày điều đó đã thay đổi. [Leon, ngươi nghĩ mình đủ khả năng sao?] Kiếm thánh đáng ra phải chọn người hùng trong lời tiên tri lại về tay hắn. Gì cơ? Bạn bất tài, nghèo khó và chẳng có ai chống lưng á? Đừng lo! Người hùng với thanh kiếm thánh có thể giải quyết mọi chuyện tới rồi đây! “...Có một khoảng thời gian ta cũng nghĩ như vậy. ” Đây là nơi bắt đầu của hành trình người hùng của Leon.",//st.nettruyenup.com/data/comics/109/che-ngu-kiem.jpg,https://www.nettruyenup.com/truyen-tranh/che-ngu-kiem-63085
Thợ Săn Top 1 Trở Lại,Chapter 22,Tình trạng:Đang tiến hành,Bình luận:328,Ngày cập nhật:1 ngày trước,Lượt xem:247K,"Noah, người từng là một thợ săn cấp S, đã phong ấn sức mạnhcủa mình sau khi anh ta vô tình giết chết người bạn thân nhất. Kể từ đó, anh ta trở thành một bác sĩ ít người biết đến trong một thị trấn nhỏ. Một cuộc gặp gỡ tình cờ với một thợ săn khác, Xia Zuo, khiến anh ta phát hiện ra rằng người bạn thân nhất của anh ta có thể không nhất thiết phải chết. Cùng nhau, Noah và Xia Zuo bắt đầu cuộc hành trình khám phá những bí ẩn của quá khứ.",//st.nettruyenup.com/data/comics/1/tho-san-top-1-tro-lai.jpg,https://www.nettruyenup.com/truyen-tranh/tho-san-top-1-tro-lai-72449
"Bị thiêu rụi bởi ngọn lửa địa ngục, hồi sinh với tư cách hoả thuật sư mạnh nhất",Chapter 58,"Thể loại:Action, Adventure, Fantasy, Manga, Shounen",Lượt xem:2.864K,Theo dõi:35K,Tình trạng:Đang tiến hành,"Một ""ngọn lửa địa ngục"" được phong ấn có thể thiêu rụi mọi thứ trên thế giới. Một chàng trai tầm thường, Flair, sống ở một vùng làng quê hẻo lánh, được chọn làm vật hy sinh để hiến tế cho cánh cửa.sau khi bước vào cánh cổng địa ngục ... Hắn không thể chết vì một lý do nào đó !? Flair, người đã vượt qua ngọn lửa và trở lại thế giới này, có sức mạnh để làm chủ ngọn lửa của địa ngục !! Ltd.",//st.nettruyenup.com/data/comics/228/bi-thieu-rui-boi-ngon-lua-dia-nguc-hoi-s-9186.jpg,https://www.nettruyenup.com/truyen-tranh/bi-thieu-rui-boi-ngon-lua-dia-nguc-hoi-sinh-voi-tu-cach-hoa-thuat-su-manh-nhat-393960
Tôi Trở Thành Mẹ Kế Của Cinderella,Chapter 94,Tình trạng:Đang tiến hành,Bình luận:2.019,Ngày cập nhật:1 ngày trước,Lượt xem:6.178K,"Một câu chuyện cổ tích nổi tiếng. Cô gái tốt bụng có cha và mẹ kế đã kết hôn trở thành một gia đình gồm năm người với hai chị kế. Cô gái đáng thương bị lên án bởi mẹ và chị kế. Câu chuyện cổ tích, Cinderella. Nhưng tôi không phải là Cinderella, tôi là mẹ kế. Ở tuổi ba mươi bảy, đã kết hôn hai lần, bị góa chồng hai lần và đang nuôi ba con gái! Daniel Walford, một người đàn ông tiếp cận tôi trong khi tôi bận rộn cố gắng nuôi ba con gái của mình. ""Tôi có thể hôn cô không?"" Là một con rể, tôi nghĩ cậu ta có hơi lớn tuổi một chút nhưng sao cậu ta cứ tiếp cận? ... Ồ, tôi không biết. Một khi tôi để Cinderella kết hôn với hoàng tử, tôi có thể sống lặng lẽ. Nhưng câu chuyện cổ tích này có thực sự là 'Cinderella' không?",//st.nettruyenup.com/data/comics/71/toi-tro-thanh-me-ke-cua-cinderella.jpg,https://www.nettruyenup.com/truyen-tranh/toi-tro-thanh-me-ke-cua-cinderella-392544
Bác Sĩ Phẫu Thuật Cấp Sss,Chapter 31,"Thể loại:Action, Magical, Manhwa, Truyện Màu",Lượt xem:818K,Theo dõi:18K,Tình trạng:Đang tiến hành,"Raymond là con trai ngoài giã thú của nhà vua. Vì bị khinh miệt và cảm thấy xấu hổ, anh ấy đã bỏ trốn và trở thành một trị liệu sư… để rồi bị chế giễu vì đạt hạng F. Rồi một ngày nọ, một điều kỳ diệu đã đến với anh. [Bạn đã thức tỉnh với tư cách là một người chơi!] [Công việc: Bác sĩ phẫu thuật (cấp SSS)] Raymond có được những kiến thức y học chưa từng tồn tại trên thế giới này. Truyền thuyết vĩ đại về Raymond, bác sĩ phẫu thuật đầu tiên, bắt đầu ngay bây giờ!",//st.nettruyenup.com/data/comics/59/bac-si-phau-thuat-cap-sss.jpg,https://www.nettruyenup.com/truyen-tranh/bac-si-phau-thuat-cap-sss-75067
The dungeon Master,Chapter 123,"Thể loại:Action, Adventure, Chuyển Sinh, Comedy, Fantasy, Manhwa, Martial Arts, Romance",Lượt xem:7.263K,Theo dõi:38K,Tình trạng:Đang tiến hành,"Nhân vật chính của chúng ta "" Oh ju-yoon"" một dạng người điển hình có thể thấy ở đâu,mỗi ngày đều làm bán thời gian, rồi anh chết do một tai nạn, nhưng vì lòngtốt của anh, anh được gửi sang thế giới khác sống một cuộc đời mới, tuy nhiên lương lai của anh không phải là anh hùng cũng chẳng phải pháp sư mà là ..... Channel Youtube của Bạn Dịch: http://youtube.com/c/FrWitherTruyenTranhOnline Vào youtube để cập nhật truyện mới vá nhanh nhất",//st.nettruyenup.com/data/comics/147/the-dungeon-master.jpg,https://www.nettruyenup.com/truyen-tranh/the-dungeon-master-208835
Cuộc Sống Treo Máy,Chapter 28,Tình trạng:Đang tiến hành,Bình luận:1.547,Ngày cập nhật:1 ngày trước,Lượt xem:798K,,//st.nettruyenup.com/data/comics/108/cuoc-song-treo-may.jpg,https://www.nettruyenup.com/truyen-tranh/cuoc-song-treo-may-63084
Đoàn Sủng Công Chúa : Tiểu Manh Bạo Quân Vừa Ngọt Vừa Hung,Chapter 20,Tình trạng:Đang tiến hành,Bình luận:184,Ngày cập nhật:1 ngày trước,Lượt xem:439K,"Nhà nghiên cứu chính của Cao Trí Tuệ Thư xuyên đến làm nữ phụ bi thảm, ai ngờ trước có phụ thân bạo quân sủng ái thượng thiên mù quáng, sau có tỷ tỷ khống chế tiểu hoàng tử điên cuồng, thậm chí là nhị công chúa kiêu căng ương ngạnh cũng biến thân thành rắm nghe lời nữ chính không cãi, chung quanh còn có một đám muội khống ca ca, đều đối với nữ chủ coi như trân bảo, tranh giành tình cảm của nữ chính. Ngồi trong tập đoàn sủng! Đối mặt với sự khiêu khích của gia tộc và tình địch, giả heo ăn hổ, ỷ vào mỹ mạo và thực lực nghiền ép! đảo lộn thế cờ , ta đây nhất định phải sống!",//st.nettruyenup.com/data/comics/139/doan-sung-cong-chua-tieu-manh-bao-quan-v-1919.jpg,https://www.nettruyenup.com/truyen-tranh/doan-sung-cong-chua-tieu-manh-bao-quan-vua-ngot-vua-hung-76171
Xuyên Nhanh : Thiếu Gia Ốm Yếu Rất Dính Người,Chapter 18,Tình trạng:Đang tiến hành,Bình luận:184,Ngày cập nhật:1 ngày trước,Lượt xem:538K,"Hệ thống "" nhiệm vụ của cô chính là thay đổi cốt truyện , giúp các nhân vật trong truyện không gặp phải kết cục bi thảm nữa"" . nam khanh 'ừm. Vậy là nhiệm vụ chính là cứu vớt nam phụ ,nếu như vậy thì chỉ cần cho họ không tiếp xúc với nữ chính ngay từ đầu là được rồi ,ơ nhưng mà sao thế này ,bọn họ sao lại quay ra dính ta như này chứ """,//st.nettruyenup.com/data/comics/137/xuyen-nhanh-thieu-gia-om-yeu-rat-dinh-ng-8980.jpg,https://www.nettruyenup.com/truyen-tranh/xuyen-nhanh-thieu-gia-om-yeu-rat-dinh-nguoi-76169
Nếu Không Vâng Lời Công Tước,Chapter 51,Tình trạng:Đang tiến hành,Bình luận:508,Ngày cập nhật:1 ngày trước,Lượt xem:1.985K,"Cuộc hôn nhân thứ ba của Lillie, do cha cô ép buộc. Đối phương là một công tước còn được gọi là quái vật vì anh ta là một kẻ cuồng chiến, nhưng điều đó không quan trọng. Ngay từ đầu, tình cảm của Lillie đã không quan trọng. Tuy nhiên, trái ngược với những lời đồn đại, công tước là một người tốt bụng và chu đáo. Cuộc hôn nhân của Lillie hóa ra còn hơn cả mong đợi.",//st.nettruyenup.com/data/comics/19/neu-khong-vang-loi-cong-tuoc.jpg,https://www.nettruyenup.com/truyen-tranh/neu-khong-vang-loi-cong-tuoc-70675
Dành Cho Nhân Vật Bị Bỏ Rơi Yêu Thích Nhất Của Tôi,Chapter 48.1,"Thể loại:Chuyển Sinh, Cổ Đại, Drama, Manhwa, Ngôn Tình, Romance, Truyện Màu, Xuyên Không",Lượt xem:8.209K,Theo dõi:62K,Tình trạng:Đang tiến hành,"“Hãy cứu lấy người thân yêu nhất của tôi!” Hestia, bị chiếm hữu bởi cuốn tiểu thuyết của Ropan, người mà cô ấy yêu đủ để lái xe cho N vòng. Nhờ sở hữu Ngoại truyện, cuối cùng cái kết của tác phẩm cũng gặp được trực giác của các nhân vật chính! Những mong đợi trở lại hiện thực sau khi kết thúc tan vỡ, Sau khi kết thúc cuốn tiểu thuyết, ngay cả trước khi anh thoát khỏi cú sốc về cái chết của nhân vật yêu thích của mình, Caelus, đằng sau cuốn tiểu thuyết. Nó quay trở lại ngay sau khi kết thúc cuốn tiểu thuyết … ! Sau đó, lần này, tôi sẽ bảo vệ yêu thích của tôi!",//st.nettruyenup.com/data/comics/252/danh-cho-nhan-vat-bi-bo-roi-yeu-thich-nh-2554.jpg,https://www.nettruyenup.com/truyen-tranh/danh-cho-nhan-vat-bi-bo-roi-yeu-thich-nhat-cua-toi-68092
Thái Thú Kang Jin Lee,Chapter 39,"Thể loại:Action, Drama, Historical, Manhwa, Shounen, Truyện Màu, Webtoon",Lượt xem:460K,Theo dõi:10K,Tình trạng:Đang tiến hành,"Anh ấy có bị điên không? Hay chỉ là người tìm kiếm sự chú ý điển hình? Lee Kwang-Jin, người không hiểu sự khác biệt về con người, và Master Kwak No của anh ấy là người giúp anh ấy hiểu sự khác biệt của mọi người. Một câu chuyện nhân văn ấm áp của một sinh viên và Master của mình.",//st.nettruyenup.com/data/comics/219/thai-thu-kang-jin-lee.jpg,https://www.nettruyenup.com/truyen-tranh/thai-thu-kang-jin-lee-67547
Vạn Tướng Chi Vương,Chapter 270,Tác giả:Thiên tằm thổ đậu,Lượt xem:21M,Theo dõi:89K,Tình trạng:Đang tiến hành,"Lý lạc, Đệ nhất tướng thuật ngộ tính của học phủ nam phong? Chèn ép đồng bối, nhưng cũng là không tướng trời sinh, dần dần bị các bạn học đá ra phía sau.  Phương pháp giải quyết vấn đề không tướng của ba mẹ của lý lạc để lại  , lại rơi vào nghịch cảnh 5 năm phong hầu , nếu không sẽ chết .  Trong thiên địa , có vạn tướng. Mà lý lạc ta, cuối cùng sẽ trở thành Vạn tướng chi vương .",//st.nettruyenup.com/data/comics/99/van-tuong-chi-vuong.jpg,https://www.nettruyenup.com/truyen-tranh/van-tuong-chi-vuong-438750
Nguyên Tôn,Chapter 597,Tác giả:Thiên Tằm Thổ Đậu,Lượt xem:165M,Theo dõi:215K,Tình trạng:Đang tiến hành,"Một tác phẩm mới của Thiên Tằm Thổ Đậu Ta có một ngụm Huyền Hoàng Khí, có thể nuốt thiên địa nhật nguyệt tinh. ......... Lúc đó đường về, đã là một con đường vận mệnh treo ngược. Ngày xưa vinh hoa, như thay đổi khôn lường, một giấc ác mộng dài. Thiếu niên chấp bút, Long Xà bay động. Là vì một vòng quang mang bổ ra dáng vẻ nặng nề chi loạn thế, vấn đỉnh điện ngọc thương khung. Đường báo thù, cùng ta đồng hành. Một ngụm Huyền Hoàng chân khí nhất định nuốt thiên địa nhật nguyệt tinh thần, hùng thị cỏ cây thương sinh. Thiết họa tịch chiếu, vụ ải ngân câu, bút tẩu du long xông Cửu Châu. Hoành tư thiên hạ, mực vẩy thanh sơn, thôn tính biển hồ nạp trăm sông.",//st.nettruyenup.com/data/comics/146/nguyen-ton.jpg,https://www.nettruyenup.com/truyen-tranh/nguyen-ton-175540
"Trường Sinh Bất Lão, Ta Cưới Tà Thần Về Làm Vợ",Chapter 11,"Thể loại:Action, Ngôn Tình, Romance, Truyện Màu",Tình trạng:Đang tiến hành,Bình luận:1.014,Tác giả:Mộng Tiên Giới,"Trường sinh giả Lâm Trạch, triệu hoán một lão bà tà thần, đến làm bạn với mình vượt qua cuộc sống cô đơn dài dằng dặc... Vốn nên sống một cuộc sống hạnh phúc bên nhau, nhưng hai nhân vật này có sinh mệnh vĩnh hằng vô hạn này, hình như đều có mục đích riêng của mình...",//st.nettruyenup.com/data/comics/157/truong-sinh-bat-lao-ta-cuoi-ta-than-ve-l-364.jpg,https://www.nettruyenup.com/truyen-tranh/truong-sinh-bat-lao-ta-cuoi-ta-than-ve-lam-vo-75421
Bắt Đầu Với Chí Tôn Đan Điền,Chapter 215,Tình trạng:Đang tiến hành,Bình luận:16K,Ngày cập nhật:1 ngày trước,Lượt xem:36M,,//st.nettruyenup.com/data/comics/70/bat-dau-voi-chi-ton-dan-dien.jpg,https://www.nettruyenup.com/truyen-tranh/bat-dau-voi-chi-ton-dan-dien-394940
Ta Là Đại Thần Tiên,Chapter 575,Tình trạng:Đang tiến hành,Bình luận:16K,Ngày cập nhật:1 ngày trước,Lượt xem:69M,"Thần đồng tên giang mới có bảy tuổi sinh trưởng quá nhanh nên bị đoản mệnh, vì là khôi phục cuộc sống bình thường, mang theo ký ức trong cơ thể một vị đại thần tiên xông vào Tiên giới, từ đây đi tới trở thành bá chủ Tiên giới mở ra con đường truyền kỳ...",//st.nettruyenup.com/data/comics/133/ta-la-dai-than-tien.jpg,https://www.nettruyenup.com/truyen-tranh/ta-la-dai-than-tien-198450
Anh Hùng OnePunch,Chapter 227,Tác giả:ONE - Murata Yuusuke,Lượt xem:107M,Theo dõi:235K,Tình trạng:Đang tiến hành,"Một Manga thể loại siêu anh hùng với đặc trưng phồng tôm đấm phát chết luôn... và mang đậm tính chất troll của tác giả. Onepunch-man là câu chuyện của 1 chàng thanh niên 23 tuổi, đang là một nhân viên văn phòng điển trai nghiêm túc và tất nhiên là ế. Không hiểu vì biến cố gì mà tự nhiên lông tóc trên người của anh trụi lủi, sau đó anh mang trong mình khả năng siêu đặc biệt ""Đấm phát chết luôn"" nhằm bảo vệ trái đất và thành phố nơi anh sinh sống khỏi các sinh vật ngoài không gian (nhưng phá hoại cũng không kém).",//st.nettruyenup.com/data/comics/37/anh-hung-onepunch.jpg,https://www.nettruyenup.com/truyen-tranh/anh-hung-onepunch-43890
Ocd Thành Vương Giả,Chapter 31,Tình trạng:Đang tiến hành,Bình luận:969,Ngày cập nhật:1 ngày trước,Lượt xem:1.151K,,//st.nettruyenup.com/data/comics/11/ocd-thanh-vuong-gia-2049.jpg,https://www.nettruyenup.com/truyen-tranh/ocd-thanh-vuong-gia-588910
Vợ tôi là quỷ vương,Chapter 433,Tình trạng:Đang tiến hành,Bình luận:15K,Ngày cập nhật:1 ngày trước,Lượt xem:51M,Tóm tắt đơn giản thôi : Một anh Gosu LoL chuyển giới thế nào lại vớ được bà chị quỷ vương.,//st.nettruyenup.com/data/comics/35/vo-toi-la-quy-vuong.jpg,https://www.nettruyenup.com/truyen-tranh/vo-toi-la-quy-vuong-215390
Trợ Lí Siêu Sao,Chapter 32,Tình trạng:Đang tiến hành,Bình luận:116,Ngày cập nhật:1 ngày trước,Lượt xem:98K,"Hoyeon Cheon là trợ lý ở Korean Capital, một công ty tài chính nơi sự nghiệp của cậu đang lâm vào bế tắc. Đêm nọ, khi đang chật vật dọn dẹp tàn cuộc sau buổi karaoke với đồng nghiệp, cậu quyết định hát thêm một bài nữa. Cậu không biết rằng, hồn ma của một ngôi sao - ""đứa trẻ hoang dã của dòng nhạc rock"" Jihyeok Han đã luôn chờ đợi, để tìm một giọng hát hoàn hảo để mang lại ‘aura’ cho cậu ấy…",//st.nettruyenup.com/data/comics/225/tro-li-sieu-sao.jpg,https://www.nettruyenup.com/truyen-tranh/tro-li-sieu-sao-70625
Tái sinh thành thôn nữ,Chapter 12,"Thể loại:Chuyển Sinh, Comedy, Gender Bender, Josei, Manga",Lượt xem:291K,Theo dõi:4.587,Tình trạng:Đang tiến hành,Ờ thì như tựa ấy,//st.nettruyenup.com/data/comics/176/tai-sinh-thanh-thon-nu-430.jpg,https://www.nettruyenup.com/truyen-tranh/tai-sinh-thanh-thon-nu-224480
Biên Kịch Gian Lận,Chapter 11,"Thể loại:Fantasy, Manhwa, Shounen, Truyện Màu",Lượt xem:46K,Theo dõi:3.392,Tình trạng:Đang tiến hành,"Jang Yeon-jae là một trợ lý biên kịch năm thứ 6. Anh ta điên cuồng phấn đấ nhưng trước khi ra mắt, giáo viên của anh ta, nhà văn cao cấp Kim Tae-jin đã đánh cắp kịch bản của anh ta. ""Thưa ngài! Làm thế nào anh có thể làm điều này! Đó là nội dung của tôi! ""Yeon jae-ah. Đúng là tôi đã phần nào bị ảnh hưởng bởi suy nghĩ và ý tưởng của anh. Nhưng đó chắc chắn là kịch bản của tôi"". Phẫn nộ và uất ức, Sau khi từ bỏ công việc trợ lý nhà văn, anh ta đã tìm mọi cách để đánh bại Kim Tae-jin, nhưng dường như không có hy vọng nào . Nhưng ngay lúc đó... Một phép màu  đã xảy ra. [Bạn có thể mua 200 ký tự của kịch bản với xếp hạng 0,1%.] [Khi phát sóng bằng kịch bản này, xếp hạng trung bình dự kiến là 15.2%.] [Bạn có muốn mua không?] [Có / Không] Yêu cầu 'Game bắn súng trên không'! Bộ phim truyền hình được đánh giá cao của trợ lý biên kịch Jang Yeon-jae.",//st.nettruyenup.com/data/comics/105/bien-kich-gian-lan.jpg,https://www.nettruyenup.com/truyen-tranh/bien-kich-gian-lan-76649
